,name,source_full_address,full_address,street_number,street_name,unit,city,province,provider
43552,Growing Together Early Learning Centre,421 Hambrook St,421 Hambrook St,421,hambrook st,,Ladysmith,,Province of British Columbia
13056,TARADALE STUDENT CARE,170 TARAVISTA DRIVE NE,170 Taravista Drive Ne,170,taravista drive ne,,CALGARY,,Province of Alberta
32100,North Ward School-age Program,,Nan,107,Silver Street,,Paris,ON,Province of Ontario
34984,Karlie's Dayhome,Westridge Crescent Spruce Grove AB,westridge crescent ,,,,Spruce Grove,Alberta,GoDayCare.com
12506,HUNTINGTON HILLS COMMUNITY ASSOCIATION CHILD CARE PROGRAM,520 78 AVENUE NW,520 78 Avenue Nw,520,78 avenue nw,,CALGARY,,Province of Alberta
34023,Our Lady of the Bay,,Nan,795,Eyer Drive,,Pickering,ON,Province of Ontario
6839,LILLIPUT DAYCARE CENTRE OUT OF SCHOOL CARE,BASEMENT 11214 109 AVENUE,Basement 11214 109 Avenue,11214,109 avenue,basement,EDMONTON,,Province of Alberta
5173,INTERCULTURAL DAYCARE,9538 107 AVENUE,9538 107 Avenue,9538,107 avenue,,EDMONTON,,Province of Alberta
6459,HUNTINGTON HILLS COMMUNITY ASSOCIATION CHILD CARE PROGRAM,520 - 78 AVENUE NW,520 78 Avenue Nw,520,78 avenue nw,,CALGARY,,Province of Alberta
14854,THE EAST CENTRAL FAMILY DAY HOME AGENCY,5210 64 STREET,5210 64 Street,5210,64 street,,VERMILION,,Province of Alberta
36553,Gisele's Home Childcare,queen st Dorchester ON,queen st ,,,,Dorchester,Ontario,GoDayCare.com
36872,As You Need Daycare,142 Bechtel Dr. Kitchener ON,142 bechtel dr ,142,bechtel dr,,Kitchener,Ontario,GoDayCare.com
11048,LEARNED ROBIN MONTESSORI OUT OF SCHOOL CARE,10571 115 STREET NW,10571 115 Street Nw,10571,115 street nw,,EDMONTON,,Province of Alberta
9720,BRIGHTPATH CHESTERMERE,100 MAIN STREET,100 Main Street,100,main street,,CHESTERMERE,,Province of Alberta
33471,Guthrie Child Care,,Nan,22,Line 5,,Oro Station,ON,Province of Ontario
4008,REMINGTON YMCA CHILD DEVELOPMENT CENTRE,108 QUARRY PARK ROAD SE,108 Quarry Park Road Se,108,quarry park road se,,CALGARY,,Province of Alberta
7930,CP KIDZ CLUB,4815 43 STREET,4815 43 Street,4815,43 street,,SYLVAN LAKE,,Province of Alberta
29372,Heart of the Family Childcare Centre,,Nan,137,Eight Street,,Cornwall,ON,Province of Ontario
39370,Little House On Graham,2545 Graham St,2545 Graham St,2545,graham st,,Victoria,,Province of British Columbia
10844,LOTSA TOTS CHILD CARE CENTRE,29 MICHENER BEND,29 Michener Bend,29,michener bend,,RED DEER,,Province of Alberta
20223,Family or Group Child Care Home *,None,None,,,,,,Province of Manitoba
13759,KEPLER ACADEMY EARLY LEARNING AND CHILDCARE INC.,10123 99 STREET,10123 99 Street,10123,99 street,,EDMONTON,,Province of Alberta
38024,Busy Bee Daycare,Harvey Bay Weyburn SK,harvey bay ,,,,Weyburn,Saskatchewan,GoDayCare.com
8296,SOUTHSHORE CHILD CARE CENTER,72046 SOUTHSHORE DR. E.,72046 Southshore Dr E,72046,southshore dr e,,WIDEWATER,,Province of Alberta
37511,Atlantis Drive,Atlantis Dr. Whitby ON,atlantis dr ,,,,Whitby,Ontario,GoDayCare.com
6847,LOVING TO LEARN OUT OF SCHOOL CARE,500 4305 SOUTH PARK DRIVE,500 4305 South Park Drive,500 4305,south park drive,,STONY PLAIN,,Province of Alberta
34817,Amanda's Dayhome,371 Marina Drive Chestermere AB,371 marina drive ,371,marina drive,,Chestermere,Alberta,GoDayCare.com
38558,Rainbow IX,161 Hamlyn Road,161 Hamlyn Road,161,hamlyn road,,St. John's,,Province of Newfoundland and Labrador
24129,GARDERIE DES TOURNESOLS,"4193, route Marie-Victorin","4193, Route Marie Victorin",4193,route marie victorin,,Sorel-Tracy,,Province of Quèbec
10875,NEWCASTLE OUT OF SCHOOL CARE,16947 127 STREET NW,16947 127 Street Nw,16947,127 street nw,,EDMONTON,,Province of Alberta
30888,"Le Cerf-Volant, Ottawa Ouest",,Nan,20,Harrison,,Ottawa,ON,Province of Ontario
27437,ÉCOLE PRÉ-MATERNELLE TWINKLESTAR INC.,"36, chemin de la Rabastalière","36, Chemin De La Rabastalière",36,chemin de la rabastalière,,Saint-Bruno-de-Montarville,,Province of Quèbec
8,Ecole St. Joseph Afterschool Program B,Ecole St. Joseph School,Ecole St Joseph School,,,,Yellowknife,,Northwest Territories
34094,YMCA of Greater Toronto - Aurora YMCA Nursery,,Nan,15186,Yonge Street,,Aurora,ON,Province of Ontario
8100,LILLIPUT DAYCARE CENTRE OUT OF SCHOOL CARE,BASEMENT 11214 109 AVENUE,Basement 11214 109 Avenue,11214,109 avenue,basement,EDMONTON,,Province of Alberta
4647,BRIGHTPATH WHITEHORN,3704 WHITEHORN DRIVE NE,3704 Whitehorn Drive Ne,3704,whitehorn drive ne,,CALGARY,,Province of Alberta
357,Children's Playhouse,1466 Woodstock Road Fredericton E3C 1P3 (506) 454-2744,"1466 Woodstock Road Fredericton   454 2744NB, Canada",,,,,,Province of New Brunswick
12065,KIDZ JUNCTION DAYCARE,722 91 STREET SW,722 91 Street Sw,722,91 street sw,,EDMONTON,,Province of Alberta
3844,CHILD'S PLAY OUT OF SCHOOL CARE @ ST. MARGARET,3320 CAROL DRIVE NW,3320 Carol Drive Nw,3320,carol drive nw,,CALGARY,,Province of Alberta
44404,Kakayak Daycare,P.O.Box 310,Pobox 310,,,,,,Nunavut
22944,CENTRE DE LA PETITE ENFANCE LE CHAMPIGNON,"1164, boulevard Lemay","1164, Boulevard Lemay",1164,boulevard lemay,,Thetford Mines,,Province of Quèbec
1221,LA PRE-MATERNELLE LA COCCINELLE,3303 CAPITOL HILL CRES. NW,3303 Capitol Hill Cres Nw,3303,capitol hill cres nw,,CALGARY,,Province of Alberta
14955,WEST HILLHURST COMMUNITY PRE-SCHOOL,1940 6 AVENUE NW,1940 6 Avenue Nw,1940,6 avenue nw,,CALGARY,,Province of Alberta
27080,CENTRE À LA PETITE ENFANCE LES P'TITES FRIMOUSSES,"1195, rue Ricard","1195, Rue Ricard",1195,rue ricard,,Acton Vale,,Province of Quèbec
41154,Garde Scolaire Les Rigolos,1623 Bank St,1623 Bank St,1623,bank st,,Victoria,,Province of British Columbia
34058,Derrydown School Age Program - (YMCA),,Nan,120,Derrydown Road,,Toronto,ON,Province of Ontario
5402,SILVER SPRINGS DAY CARE CENTRE,7204 SILVERMEAD ROAD NW,7204 Silvermead Road Nw,7204,silvermead road nw,,CALGARY,,Province of Alberta
381,Co-op Wee Care Daycare Education and Learning Center,190 Doak Road Fredericton E3C 2G2 (506) 444-0505,"190 Doak Road Fredericton   444 0505NB, Canada",,,,,,Province of New Brunswick
36260,Karen Sherman's Daycare,magani ave Bradford West Gwillimbury ON,magani ave ,,,,Bradford West Gwillimbury,Ontario,GoDayCare.com
32601,Sisters of Our Lady of Mount Carmel - Mother of Carmel Child Care Centre,,Nan,2599,Major Mackenzie Drive,,Maple,ON,Province of Ontario
43683,Greenways Licensed Child Care Center,570 21St St W,570 21St St W,570,21st st w,,North Vancouver,,Province of British Columbia
14728,TINY TRACKS JUNCTION LTD,117 5001 52 STREET,117 5001 52 Street,117,5001 52 street,,LACOMBE,,Province of Alberta
31799,P.R.Y.D.E. St. James,,Nan,10,Clover Ridge Drive,,Ajax,ON,Province of Ontario
11748,YMCA DAVID THOMAS KING OUT OF SCHOOL CARE,22707 97 AVENUE,22707 97 Avenue,22707,97 avenue,,EDMONTON,,Province of Alberta
7214,MONKEY VILLE CHILD CARE,"BAY 1 & 2, 7750 RANCHVIEW DRIVE NW",Bay 1 & 2 7750 Ranchview Drive Nw,7750,ranchview drive nw,bay 1 & 2,CALGARY,,Province of Alberta
30522,Kids' Campus - Winchester,,Nan,40,Watford Street,,Whitby,ON,Province of Ontario
42172,Leap Frog's Home Daycare,4574 196 St,4574 196 St,4574,196 st,,Langley,,Province of British Columbia
306,BEACONSFIELD DISCOVERY DAYCARE,677 Beaconsfield Avenue Saint John E2M 2K6 (506) 647-0115,"677 Beaconsfield Avenue Saint John   647 0115NB, Canada",,,,,,Province of New Brunswick
42090,Creative Angels 2 Daycare,89 South Shore Road,89 South Shore Road,89,south shore road,,Lake Cowichan,,Province of British Columbia
38320,Future Stars Learning Centre - Site 2,60 SCOTCH PINE TERR.,60 Scotch Pine Terr,60,scotch pine terr,,HALIFAX,,Province of Nova Scotia
41111,Green Trails Montessori Daycare,2325 East Wellington Rd,2325 East Wellington Rd,2325,east wellington rd,,Nanaimo,,Province of British Columbia
4133,PINEVIEW CHRISTIAN NURSERY SCHOOL ASSOCIATION,9909 90 STREET,9909 90 Street,9909,90 street,,FORT SASKATCHEWAN,,Province of Alberta
8311,EDUCARE LEARNING AND CHILD CARE SERVICES,320A SADDLEBACK ROAD,320A Saddleback Road,320a,saddleback road,,EDMONTON,,Province of Alberta
3508,EDMONTON NORTHWEST OUT OF SCHOOL CARE,11515 127 STREET,11515 127 Street,11515,127 street,,EDMONTON,,Province of Alberta
7589,A TO Z PRE-SCHOOL,404 - 4TH AVENUE N,404 4Th Avenue N,404,4th avenue n,,COCHRANE,,Province of Alberta
10627,LITTLE OTTERS OUT OF SCHOOL CARE,4409 BLACK GOLD DRIVE,4409 Black Gold Drive,4409,black gold drive,,LEDUC,,Province of Alberta
18433,Family or Group Child Care Home *,None,None,,,,,,Province of Manitoba
8200,ENLIGHTENED BEGINNINGS,5007 47 AVENUE,5007 47 Avenue,5007,47 avenue,,GRIMSHAW,,Province of Alberta
29171,Children's Village at Stoneway,,Nan,170,Stoneway Drive,,Nepean,ON,Province of Ontario
43880,Dixie Ann Elliott,"2146 B Rosewood Drive, Saskatoon, SK, S7V 0G2",2146 b rosewood drive ,2146 b,rosewood drive,,,,Province of Saskatchewan
39396,Smilestones Junior Kindergarten - Langley,150 - 8661 201 St,150 8661 201 St,150 8661,201 st,,Langley,,Province of British Columbia
34327,YMCA Durham St Before and After School Program,,Nan,140,Durham Street,,Sudbury,ON,Province of Ontario
43136,Just For Kids After School Care At Palsson,9 Grosskleg Way,9 Grosskleg Way,9,grosskleg way,,Lake Cowichan,,Province of British Columbia
26671,LE CENTRE DE LA PETITE ENFANCE LA GIBOULÉE,"531, rue Huberdeau","531, Rue Huberdeau",531,rue huberdeau,,Laval,,Province of Quèbec
33995,Bolton C. Falby YMCA Schoolage,,Nan,80,Falby Court,,Ajax,ON,Province of Ontario
31647,Oakville Family YMCA - St. Nicholas,,Nan,255,Morden Road,,Oakville,ON,Province of Ontario
12466,EVERGREEN CHILD CARE,167 EVERMEADOW AVE SW,167 Evermeadow Ave Sw,167,evermeadow ave sw,,CALGARY,,Province of Alberta
8340,LITTLE ANGELS' DAYCARE AND OUT OF SCHOOL CARE,10345 144 ST,10345 144 St,10345,144 st,,EDMONTON,,Province of Alberta
11412,SANKALPA,"50, 919 - 9 AVENUE SE",50 919 9 Avenue Se,50 919,9 avenue se,,CALGARY,,Province of Alberta
4925,RED DEER FAMILY DAY HOME PROGRAM,2-5571 45 STREET,2 5571 45 Street,2 5571,45 street,,RED DEER,,Province of Alberta
43280,Cloverdale Discovery Centre,17673 58 Ave,17673 58 Ave,17673,58 ave,,Surrey,,Province of British Columbia
12081,BALWIN OUT OF SCHOOL CARE,13112 68 STREET,13112 68 Street,13112,68 street,,EDMONTON,,Province of Alberta
12237,KLARVATTEN PLAZA OSC,16717 84 STREET,16717 84 Street,16717,84 street,,EDMONTON,,Province of Alberta
3420,KIDS PARADISE DAYCARE,6-8 76 GROSVENOR BLVD,6 8 76 Grosvenor Blvd,,,,ST. ALBERT,,Province of Alberta
2186,PEEKABOO OUT OF SCHOOL BEVERLY,11809 48 STREET,11809 48 Street,11809,48 street,,EDMONTON,,Province of Alberta
26403,PELUCHE CLÉMENTINE INC.,"1452, rue de l'Étoile","1452, Rue De L'Étoile",1452,rue de l'étoile,,Lévis,,Province of Quèbec
39898,Nature's Garden Childcare Centre,2801 Hoskins Rd,2801 Hoskins Rd,2801,hoskins rd,,North Vancouver,,Province of British Columbia
12770,LEARNED ROBIN MONTESSORI DAY CARE,10571 115 STREET NW,10571 115 Street Nw,10571,115 street nw,,EDMONTON,,Province of Alberta
24794,DORÉMI LE CANARI,"43, rue Hall","43, Rue Hall",43,rue hall,,Sherbrooke,,Province of Quèbec
21604,CENTRE DE LA PETITE ENFANCE LE TRAIN DE BOURGOGNE,"2515, rue Delisle, 2e étage","2515, Rue Delisle, 2E Étage",rue delisle,2e étage,2515,Montréal,,Province of Quèbec
7633,MONTESSORI NURSERY #1,2828 - 19 STREET NW,2828 19 Street Nw,2828,19 street nw,,CALGARY,,Province of Alberta
7366,SUMMIT KIDS - ALL BOYS,3519 - 36 AVENUE SW,3519 36 Avenue Sw,3519,36 avenue sw,,CALGARY,,Province of Alberta
11551,IMAGINATION PLAY & LEARN,9601 96 STREET,9601 96 Street,9601,96 street,,WEMBLEY,,Province of Alberta
28295,Alternative School Childcare Services Co-operative Incorporated,,Nan,232,Northern Avenue,,Sault Ste. Marie,ON,Province of Ontario
30865,Les Coccinelles,,Nan,1150,Ferguson,,Milton,ON,Province of Ontario
4915,BRIGHT ADVENTURES DAYCARE LTD.,"#14, 30 COUNTRY HILLS LANDING NW",#14 30 Country Hills Landing Nw,30,country hills landing nw,#14,CALGARY,,Province of Alberta
8279,PEMBINA PLAYSCHOOL ASSOCIATION,5232 50 STREET,5232 50 Street,5232,50 street,,ENTWISTLE,,Province of Alberta
9585,ELLWOOD DAYCARE,204 91 ST SW,204 91 St Sw,204,91 st sw,,EDMONTON,,Province of Alberta
26497,CENTRE DE LA PETITE ENFANCE HARMONIE SOLEIL,"6065, rue des Cardinaux","6065, Rue Des Cardinaux",6065,rue des cardinaux,,Laval,,Province of Quèbec
11943,ALBERT PARK CHILD CARE CENTRE,2839 12 AVE SE,2839 12 Ave Se,2839,12 ave se,,CALGARY,,Province of Alberta
2802,MOUNT ROYAL UNIVERSITY CHILD CARE CENTRE,4825 MOUNT ROYAL GATE SW,4825 Mount Royal Gate Sw,4825,mount royal gate sw,,CALGARY,,Province of Alberta
32478,Scholar Montessori Academy,,Nan,4697,Highway 7,,Woodbridge,ON,Province of Ontario
31520,St Victor,,Nan,20,Bernadine Street,,Scarborough,ON,Province of Ontario
27433,GARDERIE MONTARVILLE INC.,"15, rue Saint-Jacques","15, Rue Saint Jacques",15,rue saint jacques,,Saint-Bruno-de-Montarville,,Province of Quèbec
11671,CREATIVE KIDZ AFTERSCHOOL,7632 144 AVE,7632 144 Ave,7632,144 ave,,EDMONTON,,Province of Alberta
7151,SMART CHOICE DAYCARE,12138 161 AVENUE,12138 161 Avenue,12138,161 avenue,,EDMONTON,,Province of Alberta
8561,LITTLE ANGELS DAYCARE,105 - 400 MAIN STREET NORTH,105 400 Main Street North,105 400,main street north,,AIRDRIE,,Province of Alberta
10170,JUVENESCENCE - MONSIGNOR JS SMITH,2919 DOUGLASDALE BLVD SE,2919 Douglasdale Blvd Se,2919,douglasdale blvd se,,CALGARY,,Province of Alberta
12999,PETER PAN DAYCARE (ALTADORE BEFORE & AFTER SCHOOL),4506 - 16 ST. SW,4506 16 St Sw,4506,16 st sw,,CALGARY,,Province of Alberta
29414,Corporation of The Town Of Smiths Falls/St. James Before and After School Program,,Nan,5,Catherine Street,,Smiths Falls,ON,Province of Ontario
20693,L'UNIVERS DES COPAINS 2,"290, allée des Ursulines","290, Allée Des Ursulines",290,allée des ursulines,,Rimouski,,Province of Quèbec
43860,Ashwaq Abbdulla,"246 Ashworth Crescent, Saskatoon, SK, S7T 0P1",246 ashworth crescent ,246,ashworth crescent,,,,Province of Saskatchewan
38654,Les Petits Rayons De Soleil (Francophone),"2244 CHURCH RD - RTE 243, RUSTICO","2244 Church Rd Rte 243 Rustico PE, Canada",,,,,,Province of Prince Edward Island
6032,WEE CARE DROP-IN CENTER,UNIT 107/108 11735 - 105 STREET,Unit 107/108 11735 105 Street,11735,105 street,unit 107/108,GRANDE PRAIRIE,,Province of Alberta
7123,KEPLER ACADEMY EARLY LEARNING AND CHILDCARE INC.,10123 99 STREET,10123 99 Street,10123,99 street,,EDMONTON,,Province of Alberta
5457,SHIVA DAY CARE,119/121/123 MILLBOURNE ROAD EAST,119/121/123 Millbourne Road East,119/121/123,millbourne road east,,EDMONTON,,Province of Alberta
21410,GARDERIE LES PETITS BOUTS DE CHOUX DE LASALLE ENR.,"9135, rue Airlie","9135, Rue Airlie",9135,rue airlie,,LaSalle,,Province of Quèbec
13700,SERENITY PLACE DAYCARE,"9902, 92 AVENUE",9902 92 Avenue,9902,92 avenue,,GRANDE PRAIRIE,,Province of Alberta
26639,GARDERIE ÉDUCATIVE LES AMIS BOUTCHOUX,"1314 A, boulevard Curé Labelle","1314 A, Boulevard Curé Labelle",1314 a,boulevard curé labelle,,Laval,,Province of Quèbec
35250,Early Learning Childcare Cenrte,101 3200 Westwood St. Port Coquitlam BC,101 3200 westwood st port ,101 3200,westwood st port,,Port Coquitlam,British Columbia,GoDayCare.com
31763,Owl Child Care - Laurelwood,,Nan,460,Brentcliffe Drive,,Waterloo,ON,Province of Ontario
36136,A PEACE OF MIND HOME DAYCARE,WOODFERN COURT Barrie ON,woodfern court ,,,,Barrie,Ontario,GoDayCare.com
5263,MONTREUX CHILDCARE CENTRE,"#3110, 288 ST. MORITZ DRIVE SW",#3110 288 St Moritz Drive Sw,288,st moritz drive sw,#3110,CALGARY,,Province of Alberta
8875,STEPPING STONE CHILD DEVELOPMENT CENTER,109 8761 84 STREET,109 8761 84 Street,109,8761 84 street,,FORT SASKATCHEWAN,,Province of Alberta
38140,Erica's Day Care Centre,4182 HIGHWAY 7 HWY.,4182 Highway 7 Hwy,4182,highway 7 hwy,,PORTERS LAKE,,Province of Nova Scotia
453,Garderie au Bourgeonnet,67 Road Ragged Point Saint John E2K 5C3 (506) 658-4607,"67 Road Ragged Point Saint John   658 4607NB, Canada",,,,,,Province of New Brunswick
24585,LE MONDE DES FRIMOUSSES INC.,"2160, avenue Saint-Edouard","2160, Avenue Saint Edouard",avenue,saint edouard,2160,Québec,,Province of Quèbec
8145,COUNTRY KIDS CHILD CARE,818 THE BROADWAY,818 The Broadway,818,the broadway,,STANDARD,,Province of Alberta
34088,Reesor Park YMCA Child Care Centre,,Nan,69,Wooten Way,,Markham,ON,Province of Ontario
5478,MINI FRIENDS DAYCARE 2,12950/52 82 STREET,12950/52 82 Street,12950/52,82 street,,EDMONTON,,Province of Alberta
28041,Eh to Zed Preschool Canada Early Learning Acadamy,,Nan,322,Eastview Rd,,Guelph,ON,Province of Ontario
7680,KIDDIES KORNER PLAYSCHOOL,501B 3 STREET WEST,501B 3 Street West,501b,3 street west,,HANNA,,Province of Alberta
16000,CORNERSTONE CHILD DAYCARE INC. PHASE 1,5703 - 24 AVENUE NE,5703 24 Avenue Ne,5703,24 avenue ne,,CALGARY,,Province of Alberta
6741,BILINGUAL ART CHILD CARE LTD.,3715 - 67 ST. NE,3715 67 St Ne,3715,67 st ne,,CALGARY,,Province of Alberta
37072,3 Cs Child Care Service,Huronia Rd. Orillia ON,huronia rd ,,,,Orillia,Ontario,GoDayCare.com
5130,KINGDOM KIDS CHRISTIAN CHILDCARE INC.,1013 - 8 STREET SOUTH,1013 8 Street South,1013,8 street south,,LETHBRIDGE,,Province of Alberta
25231,GARDERIE AMIENS INC.,"8401, boulevard Saint-Michel","8401, Boulevard Saint Michel",boulevard saint,michel,8401,Montréal,,Province of Quèbec
26553,GARDERIE D'ENFANTS DU PAYS DES MERVEILLES DE LAVAL LIMITÉE,"650, boulevard Curé-Labelle","650, Boulevard Curé Labelle",650,boulevard curé labelle,,Laval,,Province of Quèbec
27907,Bayridge Drive Child Care Centre,,Nan,1035,Bayridge Drive,,Kingston,ON,Province of Ontario
21307,CENTRE DE LA PETITE ENFANCE SEL ET POIVRE,"77, rue Allen","77, Rue Allen",77,rue allen,,Windsor,,Province of Quèbec
8909,ACCI - OUT OF SCHOOL CARE,"134, 85 RAILWAY AVENUE SW",134 85 Railway Avenue Sw,134 85,railway avenue sw,,AIRDRIE,,Province of Alberta
19603,The Young Men's and Young Women's Christian Association of Winnipeg Inc.,"Gym and Room 2 820 McPhillips Street Winnipeg, MB",gym and room 2 820 mcphillips street ,820,mcphillips street,gym and room 2,,,Province of Manitoba
18280,KIDS & COMPANY - BOW TRAIL,4033 BOW TRAIL SW,4033 Bow Trail Sw,4033,bow trail sw,,CALGARY,,Province of Alberta
941,SANDBOX MEMORIES CHILDCARE,110 Doncaster Drive Quispamsis E2E 1R2 (506) 607-3041,"110 Doncaster Drive Quispamsis   607 3041NB, Canada",,,,,,Province of New Brunswick
1408,A CHILD'S STORY - TERWILLEGAR OSC,201 1715 TOWNE CENTRE BLVD,201 1715 Towne Centre Blvd,201 1715,towne centre blvd,,EDMONTON,,Province of Alberta
15487,WEE CARE DROP-IN CENTER,UNIT 107/108 11735 - 105 STREET,Unit 107/108 11735 105 Street,11735,105 street,unit 107/108,GRANDE PRAIRIE,,Province of Alberta
30974,Lodestar Montessori School,,Nan,265,Maple Street,,Bracebridge,ON,Province of Ontario
38490,Jack and Jill Nursery School,129 Montana Drive,129 Montana Drive,129,montana drive,,Stephenville,,Province of Newfoundland and Labrador
28914,L'√âSCALE ST. JEAN DE BR√âBEUF,,Nan,270,Chelton Chemin,,London,ON,Province of Ontario
29705,FAMILY DAY CARE SERVICES-ELLENGALE FDK/BEFORE & AFTER SCHOOL PROGRAM,,Nan,3480,Ellengale Drive,,Mississauga,ON,Province of Ontario
5994,ST. BENEDICT BEFORE AND AFTER SCHOOL CARE,75 ALTON DRIVE,75 Alton Drive,75,alton drive,,LEDUC,,Province of Alberta
43815,Abbas Haven Inc. (18 months Kindergarten),"233 Pinehouse Drive, Saskatoon, SK, S7K 6N9",233 pinehouse drive ,233,pinehouse drive,,,,Province of Saskatchewan
41347,Lively Learners,7851 Broadmoor Blvd,7851 Broadmoor Blvd,7851,broadmoor blvd,,Richmond,,Province of British Columbia
6355,PROGRESSIVE ACADEMY DAY CARE,13212 106 AVENUE,13212 106 Avenue,13212,106 avenue,,EDMONTON,,Province of Alberta
30735,Garderie Les petites mains,,Nan,1253,Pembroke Rue,,Pembroke,ON,Province of Ontario
35176,Learn And Play Child Care Centre,751 Banner Rd Lumby BC,751 banner rd ,751,banner rd,,Lumby,British Columbia,GoDayCare.com
9564,KIDS CLUB DAY CARE -BLACK DIAMOND,110 2ND STREET SE,110 2Nd Street Se,110,2nd street se,,BLACK DIAMOND,,Province of Alberta
43499,Arrow Lakes Preschool,1592 Arrow Lakes Drive,1592 Arrow Lakes Drive,1592,arrow lakes drive,,Castlegar,,Province of British Columbia
38290,The YMCA Association West Highlands Afterschool,18 MALTBY CRT.,18 Maltby Crt,18,maltby crt,,AMHERST,,Province of Nova Scotia
31947,PLASP - Ruth Thompson M.S.,,Nan,5605,Freshwater Drive,,Mississauga,ON,Province of Ontario
16489,SADDLERIDGE DAYCARE OOSC,#108 - 20 SADDLESTONE DRIVE NE,#108 20 Saddlestone Drive Ne,20,saddlestone drive ne,#108,CALGARY,,Province of Alberta
37492,Drawn Childcare,Rolling Acres Drive Welland ON,rolling acres drive ,,,,Welland,Ontario,GoDayCare.com
5798,PAINTED WOMBAT FINE ARTS PRESCHOOL,8831 FAIRMOUNT DRIVE SE,8831 Fairmount Drive Se,8831,fairmount drive se,,CALGARY,,Province of Alberta
27721,GARDERIE L'ÎLE AUX TRÉSORS,"975, rue du chardonnay","975, Rue Du Chardonnay",975,rue du chardonnay,,Drummondville,,Province of Quèbec
34419,YMCA School Age - Mountainview,,Nan,300,Spruce Street,,Collingwood,ON,Province of Ontario
22141,MAISON MONTESSORI DE PARC EXTENSION,"8482, rue Durocher","8482, Rue Durocher",8482,rue durocher,,Montréal,,Province of Quèbec
44097,Wise Owl School Age Care,"3525 13th Avenue, Regina, SK, S4T 1Z5",3525 13th avenue ,3525,13th avenue,,,,Province of Saskatchewan
13934,CHILDREN'S PLACE CHILD CARE CENTRE - OKOTOKS,102 ELIZABETH STREET,102 Elizabeth Street,102,elizabeth street,,OKOTOKS,,Province of Alberta
16253,WEE R KIDS 2 FAMILY DAY HOMES LTD.,"201, 515 - 7 STREET SOUTH",201 515 7 Street South,201,515 7 street south,,LETHBRIDGE,,Province of Alberta
1647,FUN 2 LEARN PRESCHOOL LTD.,5511 BAROC ROAD NW,5511 Baroc Road Nw,5511,baroc road nw,,CALGARY,,Province of Alberta
19041,Fatemeh Cheraghlou & Shahin Banihashemi,"85 Lake Grove Bay Winnipeg, MB",85 lake grove bay ,85,lake grove bay,,,,Province of Manitoba
35674,YMCA After School Sacred Heart,P.o. Box 836 Corner Brook NL,po  ,,,,Corner Brook,Newfoundland And Labrador,GoDayCare.com
14020,HANAN'S OUT OF SCHOOL CARE,"100, 3829-27 ST NE",100 3829 27 St Ne,100,3829 27 st ne,,CALGARY,,Province of Alberta
15567,B-SMART LEARNING CENTER INC.,13639 66 STREET,13639 66 Street,13639,66 street,,EDMONTON,,Province of Alberta
20867,CENTRE DE LA PETITE ENFANCE AUX POUSSINOTS D'ALAKAZOU DE QUÉBEC INC.,"2020, avenue Chauveau","2020, Avenue Chauveau",2020,avenue chauveau,,Québec,,Province of Quèbec
44345,Cubs DenFDH,"39 Redwood Street, Y1A 4B2",39 Redwood Street ,39,redwood street,,,,Yukon Territory
21426,CENTRE DE LA PETITE ENFANCE LES PETITS PIERROTS,"33, avenue du Moulin","33, Avenue Du Moulin",33,avenue du moulin,,Lachine,,Province of Quèbec
33392,"University of Waterloo - E.C.E. Centre, Psychology",,Nan,200,University Avenue,,Waterloo,ON,Province of Ontario
14908,SONSHINE PARK PRESCHOOL,#7 MCKENZIE TOWNE GATE SE,#7 Mckenzie Towne Gate Se,#7,mckenzie towne gate se,,CALGARY,,Province of Alberta
41287,Ready Set Grow Child Care,4611 Princeton Ave,4611 Princeton Ave,4611,princeton ave,,Richmond,,Province of British Columbia
16806,RECHOUSE - ANDREW SIBBALD ELEMENTARY,1711 LAKE BONAVISTA DR. SE,1711 Lake Bonavista Dr Se,1711,lake bonavista dr se,,CALGARY,,Province of Alberta
7579,STETTLER REGIONAL CHILD CARE CENTER,5702 48 AVENUE,5702 48 Avenue,5702,48 avenue,,STETTLER,,Province of Alberta
16208,CHILDREN'S PLACE CHILD CARE CENTRE - OKOTOKS,102 ELIZABETH STREET,102 Elizabeth Street,102,elizabeth street,,OKOTOKS,,Province of Alberta
40577,Bowen Island Montessori School,587B Artisan Lane,587B Artisan Lane,587b,artisan lane,,Bowen Island,,Province of British Columbia
3921,SOUTHGATE MEDALLION FAMILY DAY HOMES LTD.,209-11 FAIRWAY DRIVE NW,209 11 Fairway Drive Nw,209 11,fairway drive nw,,EDMONTON,,Province of Alberta
17013,RIVER VALLEY EARLY LEARNING,3127 BOWWOOD DRIVE NW,3127 Bowwood Drive Nw,3127,bowwood drive nw,,CALGARY,,Province of Alberta
32351,Rippleton Roadsters Satellite Program,,Nan,1340,Leslie Street,,Toronto,ON,Province of Ontario
13057,BRIGHTPATH BERMUDA,3 BERMUDA ROAD NW,3 Bermuda Road Nw,3,bermuda road nw,,CALGARY,,Province of Alberta
39683,Gibsons YMCA Child Care,783 School Rd,783 School Rd,783,school rd,,Gibsons,,Province of British Columbia
17814,MONTESSORI CHILDREN'S HOUSE ACADEMY LTD. 1,108 - 2411 4 ST NW,108 2411 4 St Nw,108,2411 4 st nw,,CALGARY,,Province of Alberta
5309,AKIVA ACADEMY,140 HADDON RD SW,140 Haddon Rd Sw,140,haddon rd sw,,CALGARY,,Province of Alberta
29974,Glebe Parents' Daycare Hopewell Campus,,Nan,17,Hopewell Avenue,,Ottawa,ON,Province of Ontario
2416,THE CHILDREN'S CENTRE,"254 GREGOIRE DRIVE, BAY C",254 Gregoire Drive Bay C,gregoire drive,bay c,254,FORT MCMURRAY,,Province of Alberta
16073,SIGIS CHILD CARE SOCIETY (JOE DEMKO),200 JENSEN LAKES BLVD.,200 Jensen Lakes Blvd,200,jensen lakes blvd,,ST. ALBERT,,Province of Alberta
36476,Glen Shields Co-Operative Nursery School,7894 Dufferin Street Concord ON,7894 dufferin street ,7894,dufferin street,,Concord,Ontario,GoDayCare.com
17401,DISCOVERYLAND CHILDCARE OSC,2562 GUARDIAN ROAD NW,2562 Guardian Road Nw,2562,guardian road nw,,EDMONTON,,Province of Alberta
37028,Bright Beginnings Home Childcare,Sebastian Crescent Niagara Falls ON,sebastian crescent ,,,,Niagara Falls,Ontario,GoDayCare.com
27547,GARDERIE LES APPRENTIS EXPLORATEURS INC.,"385, rue des Colibris","385, Rue Des Colibris",385,rue des colibris,,Saint-Jean-sur-Richelieu,,Province of Quèbec
2347,CLEVER DAYCARE LTD.,3131 - 45 AVE SW,3131 45 Ave Sw,3131,45 ave sw,,CALGARY,,Province of Alberta
12945,AVONMORE CHILDREN'S WORLD LTD.,7835 76 AVENUE,7835 76 Avenue,7835,76 avenue,,EDMONTON,,Province of Alberta
36456,Kyra's Home Daycare,Burham Ave Colborne ON,burham ave ,,,,Colborne,Ontario,GoDayCare.com
39688,Sunny House Family Child Care,605-1050 Smithe St,605 1050 Smithe St,1050,smithe st,605,Vancouver,,Province of British Columbia
16948,ALDERGROVE COMMUNITY LEAGUE CHILD CARE,8535 182 STREET,8535 182 Street,8535,182 street,,EDMONTON,,Province of Alberta
