name,source_facility_type,source_id,full_address,provider
College Ahuntsic,Junior College,FJAA,"9155 Rue St-Hubert, Montreal, Quebec, Canada, (514) 389-5921",Employment and Social Development Canada
College de Chicoutimi,Junior College,FJAB,"534 Est Rue Jaques-Cartier, Chicoutimi, Quebec, Canada, 4185499520",Employment and Social Development Canada
College de Saint-Felicien,Junior College,FJAF,"1105 Boul. Hamel C.P. 7300, St. Felicien, Quebec, Canada, (418) 679-5412",Employment and Social Development Canada
Dawson College (Cegep),Junior College,FJAG,"3040 Sherbrooke Street W., Montreal, Quebec, Canada, 5149318731",Employment and Social Development Canada
Cegep - College de la Gaspesie et des Iles,Junior College,FJAI,"96, rue Jacques Cartier, Gaspe, Quebec, Canada, (418) 368-2201",Employment and Social Development Canada
John Abbott College (Cegep),Junior College,FJAM,"21 275 Lakeshore Rd., Ste. Anne De Bellevue, Quebec, Canada, (514) 457-6610",Employment and Social Development Canada
College de Jonquiere (Cegep),Junior College,FJAN,"2505 Rue St.-Hubert, Jonquiere, Quebec, Canada, (418) 547-2191",Employment and Social Development Canada
College de Levis-Lauzon,Junior College,FJAP,"205 Mgr. Bourget, Lauzon, Quebec, Canada, (418) 833-5110",Employment and Social Development Canada
College de Saint-Jerome,Junior College,FJAQ,"455 Rue Fournier, Saint-Jerome, Quebec, Canada, (450) 436-1580",Employment and Social Development Canada
"College de Victoriaville,",Junior College,FJAR,"475 Notre-Dame Est, Victoriaville, Quebec, Canada, (819) 758-6401",Employment and Social Development Canada
College Montmorency (Cegep),Junior College,FJAS,"475 Blvd. De L'Avenir, Laval, Quebec, Canada, (514) 975-6100",Employment and Social Development Canada
College de Maisonneuve,Junior College,FJAV,"3800 Est Rue Sherbrooke, Montreal, Quebec, Canada, (514) 254-7131",Employment and Social Development Canada
CEGEP de la Pocatiere,Junior College,FJBA,"140, 4ieme Ave, La Pocatiere, Quebec, Canada, (418) 856-1525",Employment and Social Development Canada
Champlain Regional College - St Lambert Longueuil Campus,Junior College,FJBB,"900 Riverside Drive, St Lambert, Quebec, Canada, (450) 672-7360",Employment and Social Development Canada
Champlain College Lennoxville,Junior College,FJBC,"2580 College Street, Sherbrooke, Quebec, Canada, (819) 564-3666",Employment and Social Development Canada
College de Rimouski,Junior College,FJBE,"60 Rue De L'Eveche Ouest, Rimouski, Quebec, Canada, (418) 723-1880",Employment and Social Development Canada
Cegep de l'Abitibi-Temiscamingue,Junior College,FJBF,"425, boulevard du College, Rouyn-Noranda, Quebec, Canada, 819-762-0931",Employment and Social Development Canada
College de Trois-Rivieres (Cegep),Junior College,FJBM,"3500 Rue De Courval, Trois-Rivieres, Quebec, Canada, (819) 376-1721",Employment and Social Development Canada
Vanier College (Cegep),Junior College,FJBN,"821 St. Croix Street, Laurent, Quebec, Canada, 5147447500",Employment and Social Development Canada
CEGEP du Vieux-Montreal,Junior College,FJBO,"N/A, 255 Rue Ontario Est, Montreal, Quebec, Canada, (514) 982-3437",Employment and Social Development Canada
CEGEP DE THETFORD,Junior College,FJBT,"671 boul Frontenac Ouest, Thetford Mines, Quebec, Quebec, Canada, (418) 338-5591",Employment and Social Development Canada
College de Bois-De-Boulogne,Junior College,FJBV,"10555 Avenue De, Bois-De-Boulogne, Montreal, Quebec, Canada, (514) 332-3000",Employment and Social Development Canada
College de Rosemont (Cegep),Junior College,FJBW,"6400 16 E. Ave., Montreal, Quebec, Canada, (514) 376-1620",Employment and Social Development Canada
Cegep de la Gaspesie et des Iles - Carleton,Junior College,FJCB,"776 Boulevard Perron, Carleton-Sur-Mer, Quebec, Canada,",Employment and Social Development Canada
Cegep Saint-Jean-Sur-Richelieu,Junior College,FJCC,"C.P. 1018, 30 boul du Seminaire, Saint-Jean-Sur-Richelieu, Quebec, Canada, (514) 347-5301",Employment and Social Development Canada
College de Valleyfield,Junior College,FJCE,"169 Rue Champlain, Valleyfield, Quebec, Canada, 5143739441",Employment and Social Development Canada
Heritage College - Cegep,Junior College,FJCK,"325, boul. Cite des Jeunes, Gatineau, Quebec, Canada, 8197782270",Employment and Social Development Canada
Cegep Baie-Comeau,Junior College,FJCT,"537 Bleau, Baie-Comeau, Quebec, Canada, (418) 589-5707",Employment and Social Development Canada
Centre de Formation Proffessionelle (C.F.P.) Limoilou,Junior College,FJCY,"2050 8e Ave., Quebec, Quebec, Canada, (418) 525-8182",Employment and Social Development Canada
Centre de Formation Professionnelle (C.F.P.) Relance,Junior College,FJDD,"155, Mgr. Ross Ouest, C.P. 1268, Chandler, Quebec, Canada, 4186893911",Employment and Social Development Canada
TAV College,Junior College,FJDF,"6333 Decarie Boulevard , Montreal, Quebec, Canada, (514) 731-2296",Employment and Social Development Canada
College Ultra De Montreal,Junior College,FJDO,"502, 1255 Boulevard, Robert-Bourassa, Montreal, Quebec, Canada, 5142252540",Employment and Social Development Canada
Cegep Garneau,Junior College,FJDP,"1660 Boulevard de l entente, Quebec City, Quebec, Canada, 4186888310",Employment and Social Development Canada
Ecole de Technologie Superieure,Junior College,FJDQ,"1100 Notre Dame Street West, Montreal , Quebec, Canada, 5143968800",Employment and Social Development Canada
CEGEP de Sherbrooke,Junior College,FJDR,"475 Rue du Cegep, Sherbrooke, Quebec, Canada, 8195646350",Employment and Social Development Canada
Centre de Formation Professionnelle de la Baie-James,Junior College,FJDS,"265-A Rue Lanctot, Chibougamau, Quebec, Canada,",Employment and Social Development Canada
College Salette,Junior College,FJDT,"3536 Boul. St-Laurent, Montreal, Quebec, Canada,",Employment and Social Development Canada
Campus D’Effets Visuels Inc.,Junior College,FJDU,"226 ave Papineau #105, Montreal, Quebec, Canada,",Employment and Social Development Canada
College Air Richelieu,Junior College,FJDV,"5800 Route De l’Aeroport, St-Hubert, Quebec, Canada,",Employment and Social Development Canada
Herzing College (Montreal),Private Institution,FPAA,"1616 Rene Levesque Blvd., Montreal, Quebec, Canada, 514-935-7494",Employment and Social Development Canada
"CDI College of Business, Technology, Health Care",Private Institution,FPAF,"416, boulevard de, Maisonneuve Ouest, Montreal, Quebec, Canada, 5148494757",Employment and Social Development Canada
National Theatre School of Canada,Private Institution,FPAL,"5030 Saint - Dennis, Montreal, Quebec, Canada, 5148427954",Employment and Social Development Canada
College O'sullivan de Montreal,Private Institution,FPAN,"1191, rue de la Montagne, Montreal, Quebec, Canada, (514) 866-4622",Employment and Social Development Canada
Bart College,Private Institution,FPBC,"751 Cote D'Abraham, Quebec, Quebec, Canada, (418) 522-3906",Employment and Social Development Canada
Lasalle College,Private Institution,FPBH,"2000 Sainte-Catherine St. W., R-D, Montreal, Quebec, Canada, 5149392006",Employment and Social Development Canada
College Lafleche,Private Institution,FPBJ,"1687 Blvd Du Carmel, Trois-Rivieres, Quebec, Canada, (819) 375-7346",Employment and Social Development Canada
College O'sullivan de Quebec,Private Institution,FPBN,"600 Rue St-Jean, Quebec, Quebec, Canada, (418) 529-3355",Employment and Social Development Canada
College de L'immobilier du Quebec,Private Institution,FPBZ,"600 Chemin du Golf, Ile des Soeurs, Quebec, Canada, (514) 762-1862",Employment and Social Development Canada
INSTITUT TECHNIQUE AVIRON MTL.,Private Institution,FPCC,"5460 Royalmount, Ville Mont-Royal, Quebec, Canada,",Employment and Social Development Canada
Trebas Institute,Private Institution,FPCM,"550 Sherbrooke Street West, 6th Floor, East Tower, Montreal, Quebec, Canada, 5148454141",Employment and Social Development Canada
College de Photographie Marsan,Private Institution,FPCX,"3536 St. Laurent Blvd., Montreal, Quebec, Canada, (514) 525-3030",Employment and Social Development Canada
College Inter-Dec,Private Institution,FPCY,"2000 rue Sainte Catherine W, Suite 8000, Montreal, Quebec, Canada, 5149394444",Employment and Social Development Canada
Aviron Quebec Inc.,Private Institution,FPDP,"270 Blvd. Charest, Quebec, Quebec, Canada, (418) 529-1321",Employment and Social Development Canada
Recording Arts Canada,Private Institution,FPDS,"390, Notre-Dame Ouest, Bureau 320, Montreal, Quebec, Canada, 5142864336",Employment and Social Development Canada
Ecole de Stenographie Judiciaire du Quebec,Private Institution,FPEE,"465 rue Saint-Jean, bureau 505, Montreal, QC, Quebec, Canada, (514) 954-3459",Employment and Social Development Canada
Rosemount Technology Centre,Private Institution,FPEF,"3737 Beaubien, Montreal, Quebec, Canada, (514) 376-4725",Employment and Social Development Canada
Ecole National de Cirque,Private Institution,FPEQ,"8181 2nd Ave., Montreal, Quebec, Canada, 5149820859",Employment and Social Development Canada
C.F.P. - Sorel-Tracy,Private Institution,FPFE,"2725 boul de Tracy, Sorel-Tracy, Quebec, Canada, 4507431285",Employment and Social Development Canada
Syn Studio,Private Institution,FPFF,"460 Saint Catherine West, #508, Montreal, Quebec, Canada, 5149987625",Employment and Social Development Canada
Institut Grasset,Private Institution,FPFG,"220 Avenue, Fairmount Ouest, Montreal, Quebec, Canada, 5142774027",Employment and Social Development Canada
Centre de Formation Professionnelle de l'ASBESTERIE,Private Institution,FPFH,"340 Boulevard Morin, Asbestos, Quebec, Canada, 8198790769",Employment and Social Development Canada
Centre de Formation Professionnelle de 24 Juin,Private Institution,FPFI,"2955 Boulevard de lUniversite, Sherbrooke, Quebec, Canada,",Employment and Social Development Canada
Centre de Formation Professionnelle Gabriel Rousseau,Private Institution,FPFJ,"1155, boul Guillaume-Couture, Levis, Quebec, Canada, 4188390508",Employment and Social Development Canada
College Universel,Private Institution,FPFK,"101 Rue Saint Jean Bosco, Gatineau, Quebec, Canada, 8135032400",Employment and Social Development Canada
Academie de Massage Scientifique,Private Institution,FPSW,"1375 rue Janelle, Drummondville, Quebec, Canada, (819) 475-1996",Employment and Social Development Canada
CDI College - Pointe-Claire,Private Institution,FPTJ,"1000 Boulevard Saint-Jean, Suite 500, Pointe-Claire, Quebec, Canada, 5147820539",Employment and Social Development Canada
Bishop's University,University,FUAA,"2600 College Street, Sherbrooke, Quebec, Canada, (819) 822-9600",Employment and Social Development Canada
Concordia University,University,FUAC,"1550 de Maisonneuve Blvd W, Guy-Metro (GM), Room 230, Montreal, Quebec, Canada, 5148482424",Employment and Social Development Canada
Universite de Montreal,University,FUAD,"Pavillon J.A. Deseve, 2332 Boul Edouard-Montpetit, 4th Fl. Rm 4302, Montreal, Quebec, Canada, (514) 343-7076",Employment and Social Development Canada
Universite de Montreal School of Veterinary Medicine,University,FUAE,"C.P. 5000, St Hyacinthe, Quebec, Canada, 5147738521",Employment and Social Development Canada
Universite du Quebec a Montreal,University,FUAG,"Pavillion J.A. DéSève, Bureau DS-R305, 320 Rue Sainte-Catherine Est, Montreal, Quebec, Canada, (514) 987-3000",Employment and Social Development Canada
Universite du Quebeca Chicoutimi,University,FUAI,"555 Boul. De L'Universite, Chicoutimi, Quebec, Canada, (418) 545-5005",Employment and Social Development Canada
Universite du Quebec En Outaouais,University,FUAJ,"101 rue Saint-Jean-Bosco, station BPO Box 1250, Gatineau, Quebec, Canada, (819) 773-1680",Employment and Social Development Canada
Universite de Sherbrooke,University,FUAL,"2500 Boul. De L'Universite, Sherbrooke, Quebec, Canada, 8198217684",Employment and Social Development Canada
Mcgill University,University,FUAN,"Macdonald Campus, Student Services Centre, 21,111 Lakeshore, Ste-Anne De Bellevue, Quebec, Canada, (514) 398-6013",Employment and Social Development Canada
Université du Québec en Abitibi-Témiscamingue,University,FUAO,"445, boulevard de l'Universite, C.P. 700, Rouyn-Noranda, Quebec, Canada, 8197620971",Employment and Social Development Canada
Universite du Quebec - Ecole de Technologie Superieur,University,FUAQ,"A/S De Monique Gagnon, Service D'Aide Financière, 1100, Rue Notre-Dame Ouest, Montreal, Quebec, Canada, (514) 289-8800",Employment and Social Development Canada
HEC Montreal,University,FUAR,"Côte-Sainte-Catherine Building, 3000 Côte-Sainte-Catherine Rd, Montréal, Quebec, Canada, 5143406000",Employment and Social Development Canada
Ecole Polytechnique de Montreal,University,FUAS,"2900 boul Edourd-Montpetit, C.P. 6079 Succ. Centre Ville, Montreal, Quebec, Canada, (514) 340-4711",Employment and Social Development Canada
Institut national de recherche scientifiques,University,FUAT,"490 rue de la Couronne, Quebec, Quebec, Canada, 418-654-4677",Employment and Social Development Canada
Universite Laval,University,FUAU,"Bureau - bourses et aide finan, Pavillon Alphonse-Desjardins, 2325, rue de l'Université, loc, Quebec, Quebec, Canada,",Employment and Social Development Canada
Mcgill University,University,FUAV,"Blouin-Macbain Student Aid Cnr, 3600 Mctavish St. - Suite 3200, Montreal, Quebec, Canada, (514) 398-6013",Employment and Social Development Canada
Presbyterian College of Montreal,University,FUAX,"3495 University St., Montreal, Quebec, Canada, (514) 288-5256",Employment and Social Development Canada
Universite du Quebec Tele Universite,University,FUBC,"455 Rue Du Parvis, Quebec, Quebec, Canada, (800) 561-2263",Employment and Social Development Canada
Ecole Nationale D'Administration Publique (Enap),University,FUBE,"4750, Avenue Henri-Julien, 5ieme Etage, Montreal, Quebec, Canada, (514) 849-3449",Employment and Social Development Canada
Institut Maritime du Quebec,Technical and Vocational,FVAB,"53 St-Germain Ouest, Rimouski, Quebec, Canada, (418) 724-2822",Employment and Social Development Canada
Institut Teccart (2003),Technical and Vocational,FVAG,"3030, rue Hochelaga, Montreal, Quebec, Canada, (514) 526-2501",Employment and Social Development Canada
Centre de Formation Professionnelle Pavillon de L'Avenir,Technical and Vocational,FVAV,"65, Rue Sainte-Anne, Riviere-Du-Loup, Quebec, Canada, 4188682286",Employment and Social Development Canada
CFP Competences Outaouais,Technical and Vocational,FVBH,"183 Broadway Ouest, Gatineau, Quebec, Canada, 8196434640",Employment and Social Development Canada
Centre de Formation L'Envol,Technical and Vocational,FVBO,"15 Rue Comeau, Carleton, Quebec, Canada, (418) 364-7510",Employment and Social Development Canada
Centre de Formation Professionel Gabriel-Rousseau,Technical and Vocational,FVCA,"3724 Avenue_Des Eglises, Charny, Quebec, Canada, (418) 832-1616",Employment and Social Development Canada
Conservatoire de Musique et D'Art Dramatique de Montreal,Technical and Vocational,FVCN,"4750, Avenue Henri-Julien, Montreal, Quebec, Canada, (514) 873-4283",Employment and Social Development Canada
Eastern Shores School Board,Technical and Vocational,FVCT,"40 Mount Sorel, New Carlisle, Quebec, Canada, 4187522247",Employment and Social Development Canada
Centre de Formation Professionnelle (C.F.P.)Mont-Joli-Mittis,Technical and Vocational,FVCV,"1414, Rue Des Erables, Mont-Joli, Quebec, Canada, (418) 775-7577",Employment and Social Development Canada
John F. Kennedy Business Centre,Technical and Vocational,FVCY,"3030 Villeray St, Montreal, Quebec, Canada,",Employment and Social Development Canada
Nova Career Centre,Technical and Vocational,FVCZ,"70 Maple Blvd., Chateauguay, Quebec, Quebec, Canada, (450) 691-2540",Employment and Social Development Canada
Listuguj Migmag Development Centre,Technical and Vocational,FVDE,"2 Pacific Dr., Listuguj, Quebec, Canada, 4187885668",Employment and Social Development Canada
Institut de Technologie Agroalimentaire St Hyacinthe,Technical and Vocational,FVDF,"3230 rue Sicotte, Saint-Hyacinthe, Quebec, Canada, 4507786504",Employment and Social Development Canada
Ecole des Metiers du Sud-Ouest de Montreal,Technical and Vocational,FVDG,"717 Rue Saint Ferdinand, Montreal, Quebec, Canada,",Employment and Social Development Canada
Centre de Formation Professionnelle Access,Technical and Vocational,FVDH,"2121 Darwin Street, Sainte-Julie, Quebec, Canada,",Employment and Social Development Canada
Centre Frere Moffet FP,Technical and Vocational,FVDI,"9 Rue Notre-Dame-de-Lourdes, Ville-Marie, Quebec, Canada, (819) 629-2144",Employment and Social Development Canada
Centre De Formation Professionnelle Lennoxville Vocational Training Centre,Technical and Vocational,FVDJ,"1700 rue College, Sherbrooke, Quebec, Canada, 8195635627",Employment and Social Development Canada
Ecole des Metiers de lequipement Motorise de,Technical and Vocational,FVDK,"5455 rue Saint Denis, Montreal, Quebec, Canada, 5145965855",Employment and Social Development Canada
Cegep Edouard Montpetit,Technical and Vocational,FVDL,"945 Ch. Chambly, Longueuil, Quebec, Canada,",Employment and Social Development Canada
Centre De Formation Professionnelle de Forestville,Technical and Vocational,FVDM,"34, 11e Rue, Forestville, Quebec, Canada, (418) 587-4735",Employment and Social Development Canada
Centre de formation professionnelle Val-d’or,Technical and Vocational,FVDN,"700 boul des Pins, Val-d'Or, Quebec, Canada,",Employment and Social Development Canada
Centre de Formation Des Metiers De la Sante,Technical and Vocational,FVDO,"3501 bl Saint-Charles, Kirkland, Quebec, Canada,",Employment and Social Development Canada
