Name,Prov_Terr,City,Address,Age_Groups,Telephone,
Le Ch√¢teau Des Bouts Choux,New Brunswick,Shediac,469 Main Street Shediac NB,Preschool Schoolage,532-9286,
Garderie Communautaire Les Schtroumpfs Inc.,New Brunswick,Shippagan,203 Rue Louden Shippagan NB,Infant Preschool Schoolage,336-4538,
Halte Scolaire Carrefour De La Jeunesse,New Brunswick,St-basile,4 Rue Eug√®ne St-Basile NB,Schoolage,263-5035,
Halte Scolaire Krok Soleil,New Brunswick,St-basile,318 Chemin Rg.3 St-Basile NB,Schoolage,739-5455,
Halte Scolaire Rivi√®re-Verte,New Brunswick,St-basile,4 Rue Eug√®ne St-Basile NB,Schoolage,263-5035,
Halte Scolaire St-Basile,New Brunswick,St-basile,4 Rue Eug√®ne St-Basile NB,Schoolage,263-5035,
Halte Scolaire St-Joseph,New Brunswick,St-basile,4 Rue Eug√®ne St-Basile NB,Schoolage,263-5035,
Krok Soleil ¬´ √Ä Maison ¬ª Enr.,New Brunswick,St-basile,318 Chemin Rang 3 St-Basile NB,Schoolage,739-5455,
Pr√©-Maternelle St-Basile,New Brunswick,St-basile,4 Rue Eug√®ne St-Basile NB,Preschool,263-5035,
La Garderie La Girouette,New Brunswick,St-isidore,4 Rue Beaulieu St-Isidore NB,Infant Preschool,358-1183,
Garderie Centre √âducatif Cayou,New Brunswick,St-quentin,15 Rue Valcourt St-Quentin NB,Preschool Schoolage,235-9112,
Garderie Chez C√©line,New Brunswick,St-quentin,7 Rue Roussel St-Quentin NB,Preschool Schoolage,235-3014,
Garderie Chez H√©l√®ne,New Brunswick,St-quentin,203 Chemin Mgr. Martin Ouest St-Quentin NB,Preschool,235-8014,
Garderie Le Jardin D'Enfants,New Brunswick,St-quentin,6 rue Champlain St-Quentin NB,Infant Preschool Schoolage,235-1803,
Garderie Les P'tits Mousse-line,New Brunswick,St-quentin,52 rue Bois Hebert St-Quentin NB,Infant Preschool Schoolage,235-2544,
Passamaquoddy Children's Centre Inc.,New Brunswick,St. Andrews,390 Montague Street St. Andrews NB,Infant Preschool Schoolage,529-3072,
Garderie Chez Mickey Et Minnie,New Brunswick,St. Leonard,C.p. 2257 St. L√©onard NB,Infant Preschool Schoolage,423-6401,
Just For Kidz Child Development Centre,New Brunswick,St. Stephen,14 Porter Street St. Stephen NB,Infant Preschool Schoolage,465-8484,
Kings County Kids Daycare Center,New Brunswick,Sussex,126 Maple Avenue Sussex NB,Preschool,433-2524,
Sussex Co-Op Nursery School,New Brunswick,Sussex,853A Main Street. Sussex NB,Preschool,433-3444,
Tide Head Preschool And After School Center,New Brunswick,Tide Head,232 Restigouche Drive Tide Head NB,Preschool Schoolage,789-2127,
Tide Head Wee Care Day Care,New Brunswick,Tide Head,293 Alford Drive Tide Head NB,Preschool Schoolage,789-1800,
Danielle Danis - Pre-Maternelle La Pirouette,New Brunswick,Tracadie-sheila,529 Rue Loraine Tracadie-Sheila NB,Preschool,395-3258,
Garderie Joli Coeur Halte Scolaire,New Brunswick,Tracadie-sheila,4315 Rue Levine Tracadie-Sheila NB,Schoolage,395-3559,
Garderie La D√©couverte,New Brunswick,Tracadie-sheila,3120 Rue Principale Tracadie-Sheila NB,Preschool,395-5420,
Garderie La Ribambelle,New Brunswick,Tracadie-sheila,540 Chemin Saulnier Quest Tracadie-Sheila NB,Infant Preschool,395-3674,
Garderie Les Frimousses,New Brunswick,Tracadie-sheila,3708 Rue Principale Tracadie-Sheila NB,Infant Preschool Schoolage,395-9568,
Halte Scolaire La D√©couverte,New Brunswick,Tracadie-sheila,3120 Rue Principale Tracadie-Sheila NB,Schoolage,395-5420,
Halte Scolaire La Ruche,New Brunswick,Tracadie-sheila,3120 Rue Principale Tracadie-Sheila NB,Schoolage,395-5420,
Halte Scolaire La Source,New Brunswick,Tracadie-sheila,3708 Rue Principale Tracadie-Sheila NB,Schoolage,395-9568,
L'√âcole De La Petite Enfance Garderie,New Brunswick,Tracadie-sheila,4140 rue Principale Tracadie-Sheila NB,Preschool Schoolage,395-4013,
Pre Maternelle Les Marmouzets,New Brunswick,Tracadie-sheila,431 Pierre Tracadie-sheila NB,Preschool,506-600-3155,
Garderie L'√ânergicentre,New Brunswick,Val-d'amour,1 rue de l'√©cole Val-d'amour NB,Preschool Schoolage,753-5758,
Les D√©brouillard(e)s Inc.,New Brunswick,Val-d'amour,1 rue de l'ecole Val-d'amour NB,Infant Preschool,753-3596,
The Skiddle Club,New Brunswick,Woodstock,105 Connell Park Road Woodstock NB,Schoolage,328-3136,
Wee Bee Day Care,New Brunswick,Woodstock,510 Main Street Woodstock NB,Infant Preschool Schoolage,325-5437,
Woodstock After School Program,New Brunswick,Woodstock,145 Connell Park Road Woodstock NB,Schoolage,328-9722,
Woodstock Child Care Inc.,New Brunswick,Woodstock,145 Connell Park Road Woodstock NB,Infant Preschool,328-9722,
Woodstock First Nations Child Development Centre,New Brunswick,Woodstock,3 Wulastook Ct. Woodstock NB,Preschool Schoolage,328-4332,
Astros Infant Care Centre,Newfoundland And Labrador,Bay Roberts,P.o. Box 370 Bay Roberts NL,,709-786-3400,
First Steps Preschool,Newfoundland And Labrador,Bay Roberts,104 Bareneed Rd. Bay Roberts NL,Toddler Kindergarten Preschool,7097860811,
Play 'n' Learn Preschool,Newfoundland And Labrador,Bay Roberts,27 Cleary's Road Bay Roberts NL,Toddler Kindergarten Preschool Schoolage,709-786-0484,
Little Stepping Stones,Newfoundland And Labrador,Bishop's Falls,399 Main Street Bishop's Falls NL,Toddler Kindergarten Preschool Schoolage,709-256-6030,
Early Learning Centre,Newfoundland And Labrador,Botwood,11 Church Road Botwood NL,Kindergarten Preschool Schoolage,709-257-2600,
Keyin College Early Learning And Development Centre,Newfoundland And Labrador,Carbonear,81 Lemarchant Street Carbonear NL,Toddler Kindergarten Preschool Schoolage,709-596-0885,
Early Discoveries Preschool,Newfoundland And Labrador,Clarenville,234 Marine Drive Clarenville NL,Toddler Kindergarten Preschool Schoolage,709-466-3774,
Toddlers Corner Day Care,Newfoundland And Labrador,Clarenville,1 C SWan Avenue Clarenville NL,Toddler Kindergarten Preschool Schoolage,709-466-1384,
Little Peoples Workshop Afterschool Program,Newfoundland And Labrador,Clarenville-shoal Harbour,22 thomas place Clarenville-Shoal Harbour NL,Kindergarten Schoolage,709-766-9359,
'Happy Days' Family Home Daycare - Preschool,Newfoundland And Labrador,Conception Bay South,Carja Ave Conception Bay South NL,Infant Toddler Kindergarten Preschool Schoolage,834 2742,
Mary's Family Dayhome,Newfoundland And Labrador,Conception Bay South,Legion Road Conception Bay South NL,Infant Toddler Kindergarten Preschool Schoolage,7098348425,
Merry Care Day Care,Newfoundland And Labrador,Conception Bay South,14 Craigs Lane Conception Bay South NL,Toddler Kindergarten Preschool Schoolage,709-834-4548,
Rainbow,Newfoundland And Labrador,Conception Bay South,11 Quartz Place Conception Bay South NL,Toddler Kindergarten Preschool Schoolage,709-834-9161,
Roberta's Dayhome,Newfoundland And Labrador,Conception Bay South,Thistles Road Conception Bay South NL,Infant Toddler Kindergarten Preschool,834-3089,
Roots And Wings Family Child Care,Newfoundland And Labrador,Conception Bay South,Foxtrap Access Rd Conception Bay South NL,Infant Toddler Kindergarten Preschool Schoolage,763 5756,
St. Edwards Afterschool,Newfoundland And Labrador,Conception Bay South,14 Craig's Lane Conception Bay South NL,Kindergarten Schoolage,709-834-4421,
The Right Start Child Care Centre,Newfoundland And Labrador,Conception Bay South,25 Sunrise Avenue Conception Bay South NL,Toddler Kindergarten Preschool Schoolage,709-834-2114,
Tracy's Place,Newfoundland And Labrador,Conception Bay South,Reader's Hill Road Conception Bay South NL,Infant Toddler Preschool,834-0019,
Bay D‚Äôespoir Preschool,Newfoundland And Labrador,Conne River,P.o. Box 82 Conne River NL,Kindergarten Preschool Schoolage,709-538-7409,
The Four Winds,Newfoundland And Labrador,Conne River,P.o. Box 160 Conne River NL,Toddler Kindergarten Preschool Schoolage,709-882-2710,
Abc Preschool,Newfoundland And Labrador,Corner Brook,6 Greenings Hill Corner Brook NL,Kindergarten Preschool Schoolage,709-632-2200,
Come And Play Preschool,Newfoundland And Labrador,Corner Brook,P.o. Box 836 Corner Brook NL,Kindergarten Preschool Schoolage,709-639-9676,
Creative Beginnings Day Care Centre,Newfoundland And Labrador,Corner Brook,17 Montgomerie Street Corner Brook NL,Kindergarten Preschool Schoolage,709-637-2121,
Fisher Children's Centre,Newfoundland And Labrador,Corner Brook,P.O. Box 822 Corner Brook NL,Kindergarten Preschool Schoolage,709-637-8573,
Humpty Dumpty Day Care Centre,Newfoundland And Labrador,Corner Brook,210 O'Connell Drive Corner Brook NL,Toddler Kindergarten Preschool Schoolage,709- 639-9866,
King Castle Day Care Centre,Newfoundland And Labrador,Corner Brook,6 Dykes Road Corner Brook NL,Toddler Kindergarten Preschool Schoolage,709-634-1582,
Little 1 Daycare,Newfoundland And Labrador,Corner Brook,Shamrock Crescent Corner Brook NL,Infant Toddler Preschool,709 632-9355,
Stepping Stones Day Care,Newfoundland And Labrador,Corner Brook,304 O'Connell Drive Corner Brook NL,Kindergarten Preschool Schoolage,709-634-5411,
YMCA After School Sacred Heart,Newfoundland And Labrador,Corner Brook,P.o. Box 836 Corner Brook NL,Kindergarten Schoolage,709-639-9676,
JJ's Early Learning And Child Care Centre,Newfoundland And Labrador,Deer Lake,18A Church Street Deer Lake NL,Kindergarten Preschool Schoolage,709-635-1044,
Gander Day Care-Peter Pan Preschool,Newfoundland And Labrador,Gander,22 Grandy Avenue Gander NL,Toddler Kindergarten Preschool Schoolage,709-256-8193,
Peter Pan Preschool,Newfoundland And Labrador,Gander,22 Grandy Avenue Gander NL,Toddler Kindergarten Preschool Schoolage,709-256-8193,
New Fun Land,Newfoundland And Labrador,Glenwood,2 Smallwood Drive Glenwood NL,Kindergarten Preschool Schoolage,709-535-3131,
New Fun Land,Newfoundland And Labrador,Glenwood,100 Roe Avenue Glenwood NL,Toddler Kindergarten Preschool Schoolage,709-679-2283,
Little Treasure's Day Care,Newfoundland And Labrador,Glovertown,1 Priscilla Drive Glovertown NL,Toddler Kindergarten Preschool Schoolage,709-533-3301,
Creative Kids,Newfoundland And Labrador,Goulds,23 Bishop's Line Goulds NL,Toddler Kindergarten Preschool Schoolage,709-364-3890,
Creative Kids Afterschool Club,Newfoundland And Labrador,Goulds,P.o. Box 62 Goulds NL,Schoolage,709-364-3890,
Goulds Children's Centre,Newfoundland And Labrador,Goulds,31 Doyle's Road Goulds NL,Toddler Kindergarten Preschool Schoolage,709-368-4088,
Creative Learning Child Care Centre,Newfoundland And Labrador,Grand Falls-windsor,17 Hardy Avenue Grand Falls-Windsor NL,Toddler Kindergarten Preschool Schoolage,709-489-1919,
The Discovery Centre,Newfoundland And Labrador,Grand Falls-windsor,84 Goodyear Avenue Grand Falls-Windsor NL,Toddler Kindergarten Preschool Schoolage,709-489-0811,
The Toy Box Preschool,Newfoundland And Labrador,Grand Falls-windsor,1 Ruston Avenue Grand Falls-Windsor NL,Toddler Kindergarten Preschool Schoolage,709-489-3535,
Y After-School Fun Time,Newfoundland And Labrador,Grand Falls-windsor,13 Price's Avenue Grand Falls-Windsor NL,Kindergarten Schoolage,709-489-7413,
YMCA After School Care Program,Newfoundland And Labrador,Grand Falls-windsor,18 St. Catherine St. Grand Falls-Windsor NL,Kindergarten Schoolage,709-489-4472,
YMCA Children's Learning Centre,Newfoundland And Labrador,Grand Falls-windsor,13 Price's Avenue Grand Falls-Windsor NL,Toddler Kindergarten Preschool Schoolage,709-489-7413,
YMCA Wee Care,Newfoundland And Labrador,Grand Falls-windsor,13 Price's Avenue Grand Falls-Windsor NL,Toddler Kindergarten Preschool Schoolage,709-257-3631,
College Of The North Atlantic Day Care,Newfoundland And Labrador,Happy Valley-goose Bay,219 Hrr Happy Valley-Goose Bay NL,Toddler Kindergarten Preschool Schoolage,709-896-6350,
Pumpkin House Day Care,Newfoundland And Labrador,Happy Valley-goose Bay,"P.o. Box 218, Stn. C Happy Valley-Goose Bay NL",Toddler Kindergarten Preschool Schoolage,709-896-8239,
Robin's Nest,Newfoundland And Labrador,Happy Valley-goose Bay,5 Wing Goose Bay Happy Valley-Goose Bay NL,Toddler Kindergarten Preschool Schoolage,709-896-6900,
Children's Essentials Daycare,Newfoundland And Labrador,Holyrood,533 Conception Bay Highway Holyrood NL,Toddler Kindergarten Preschool Schoolage,709-229-5437,
Ajagutuk Centre,Newfoundland And Labrador,Hopedale,P.o. Box 135 Hopedale NL,Toddler Kindergarten Preschool Schoolage,709-933-3821,
Skye's The Limit Family Dayhome,Newfoundland And Labrador,Labrador City,4022 Quartzite Crescent Labrador City NL,Infant Toddler Kindergarten Preschool Schoolage,709-280-2613,
Wee College Child Care Centre,Newfoundland And Labrador,Labrador City,610 Hudson Dr Labrador City NL,Toddler Kindergarten Preschool Schoolage,709-944-3636,
Sugusivut Sivunitsavut,Newfoundland And Labrador,Makkovik,P.o Box 105 Makkovik NL,Toddler Kindergarten Preschool Schoolage,709-923-2385,
Explore And Discover Child Care Centre,Newfoundland And Labrador,Marystown,P.o. Box 1293 Marystown NL,Toddler Kindergarten Preschool Schoolage,709-279-5300,
Chatter Box Day Care,Newfoundland And Labrador,Mount Pearl,1010 Topsail Rd. Mount Pearl NL,Toddler Kindergarten Preschool Schoolage,709-368-0496,
Chatterbox Kindercare And Afterschool,Newfoundland And Labrador,Mount Pearl,1020 Topsail Road Mount Pearl NL,Kindergarten Schoolage,709-364-7850,
Gingerbread House,Newfoundland And Labrador,Mount Pearl,5 Cunard Crescent Mount Pearl NL,Toddler Kindergarten Preschool Schoolage,709-747-2777,
Kidcorp,Newfoundland And Labrador,Mount Pearl,46 Commonwealth Ave Mount Pearl NL,Infant Toddler Kindergarten Preschool Schoolage,709-747-8345,
Rainbow,Newfoundland And Labrador,Mount Pearl,8 Grey Place Mount Pearl NL,Kindergarten Preschool Schoolage,709-364-6188,
Rainbow,Newfoundland And Labrador,Mount Pearl,188 Park Avenue Mount Pearl NL,Toddler Kindergarten Preschool Schoolage,709-368-0224,
Rockcliffe Children's Centre,Newfoundland And Labrador,Mount Pearl,3 Gilham Crescent Mount Pearl NL,Toddler Kindergarten Preschool Schoolage,709-726-7625,
Treasure Chest Day Care And Preschool,Newfoundland And Labrador,Mount Pearl,2 Wells Crescent Mount Pearl NL,Toddler Kindergarten Preschool Schoolage,709-368-0133,
Pigutsavik Centre,Newfoundland And Labrador,Nain,P.o. Box 250 Nain NL,Toddler Kindergarten Preschool Schoolage,709-922-1330,
Shakastueu Pishum Mitshuap,Newfoundland And Labrador,North West River,P.o. Box 160 North West River NL,Toddler Kindergarten Preschool Schoolage,709-497-8393,
Leaps And Bounds Day Care Centre,Newfoundland And Labrador,Paradise,1016 Topsail Road Paradise NL,Toddler Kindergarten Preschool Schoolage,709-368-7300,
Paradise Afterschool Program,Newfoundland And Labrador,Paradise,169 Paradise Road Paradise NL,Schoolage,709-782-0996,
Paradise Day Care And Preschool Ctr.,Newfoundland And Labrador,Paradise,169 Paradise Road Paradise NL,Toddler Kindergarten Preschool Schoolage,709-782-0996,
Precious Times Daycare,Newfoundland And Labrador,Paradise,1 Osprey Place Paradise NL,Toddler Kindergarten Preschool Schoolage,709-782-3770,
Priceless Treasures,Newfoundland And Labrador,Paradise,73 St. Thomas Line Paradise NL,Infant Toddler Kindergarten Preschool Schoolage,709-781-2345,
Sunshine Learning Centre,Newfoundland And Labrador,Paradise,2 Hummingbird Dr Paradise NL,Toddler Kindergarten Preschool Schoolage,709-782-5437,
The Learning Lobby,Newfoundland And Labrador,Paradise,2 Kinkora Street Paradise NL,Toddler Kindergarten Preschool Schoolage,709-782-4480,
Tots Learning Centre,Newfoundland And Labrador,Paradise,8 Gervase Place Paradise NL,Toddler Kindergarten Preschool Schoolage,709-782-5868,
Little Pete's Daycare,Newfoundland And Labrador,Placentia,P.O. Box 276 Placentia NL,Toddler Kindergarten Preschool Schoolage,709-227-2219,
Itsy Bitsy Daycare,Newfoundland And Labrador,Pouch Cove,P.o. Box 522 Pouch Cove NL,Toddler Kindergarten Preschool Schoolage,709-335-7191,
Reach For The Stars Daycare,Newfoundland And Labrador,South River,P.o. Box 101 South River NL,Toddler Kindergarten Preschool Schoolage,709-786-7099,
Riddles And Rhymes,Newfoundland And Labrador,St. Anthony,P.o. Box 121 St. Anthony NL,Toddler Kindergarten Preschool Schoolage,709-454-2233,
A Child's Place - Howley Estates Preschool,Newfoundland And Labrador,St. John's,160 Carrick Drive St. John's NL,Toddler Kindergarten Preschool Schoolage,709-722-9260,
Bloomsbury Child Care Centre,Newfoundland And Labrador,St. John's,389 Stavanger Drive St. John's NL,Toddler Kindergarten Preschool Schoolage,709-753-2273,
Bo-Peep Nursery And Daycare,Newfoundland And Labrador,St. John's,27 Connemara Place St. John's NL,Toddler Kindergarten Preschool Schoolage,709-754-5772,
Booth Memorial Infant Child Care Centre,Newfoundland And Labrador,St. John's,24 Forbes Street St. John's NL,Infant Toddler,09-579-6465,
Centre De La Petite Enfance Et Famille Des Grands Vents,Newfoundland And Labrador,St. John's,65 Ridge Road St. John's NL,Toddler Kindergarten Preschool,709-757-2850,
Children's Choice Learning Centre,Newfoundland And Labrador,St. John's,P.O. Box 18044 St. John's NL,Toddler Kindergarten Preschool Schoolage,709-744-3003,
College Of The North Atlantic Children's Centre,Newfoundland And Labrador,St. John's,P.O. Box 1693 St. John's NL,Toddler Kindergarten Preschool Schoolage,709-758-7444,
Confederation Building Day Care Centre,Newfoundland And Labrador,St. John's,P.o. Box 8700 St. John's NL,Toddler Kindergarten Preschool Schoolage,709-729-6038,
Daybreak Parent Child Centre Association,Newfoundland And Labrador,St. John's,74 The Boulevard St. John's NL,Toddler Kindergarten Preschool Schoolage,709-726-8373,
Dr. A.T. Brace Children's Centre,Newfoundland And Labrador,St. John's,25 Mundy Pond St. John's NL,Kindergarten Schoolage,709-739-5496,
Care-A-Lot Day Care Centre,Newfoundland And Labrador,Stephenville,30 West Street Stephenville NL,Toddler Kindergarten Preschool Schoolage,709-643-4206,
Greenland School Age Program,Newfoundland And Labrador,Stephenville,21 Colonial Avenue Stephenville NL,Kindergarten Schoolage,709-643-4206,
Jack And Jill Nursery School,Newfoundland And Labrador,Stephenville,129 Montana Drive Stephenville NL,Kindergarten Preschool Schoolage,709-643-2582,
Little Jewel Preschool Program,Newfoundland And Labrador,Stephenville,30 West Street Stephenville NL,Kindergarten Preschool Schoolage,709-643-8547,
Lourdes Preschool,Newfoundland And Labrador,Stephenville,P.o. Box 5600 Stephenville NL,Kindergarten Preschool Schoolage,709-643-5399,
Happy Tots Nursery School,Newfoundland And Labrador,Stephenville Crossing,P.o. Box 569 Stephenville Crossing NL,Kindergarten Preschool Schoolage,709-646-2822,
Stepping Stones Child Care Centre,Newfoundland And Labrador,Torbay,983 Torbay Road Torbay NL,Toddler Kindergarten Preschool Schoolage,709-A1K 1L2,
Torbay Child's Play Center,Newfoundland And Labrador,Torbay,24 Quigley's Lane Torbay NL,Toddler Kindergarten Preschool Schoolage,709-437-6190,
Playtime Child Care Centre,Newfoundland And Labrador,Wesleyville,162 Main Street Wesleyville NL,Toddler Kindergarten Preschool Schoolage,709-536-3212,
Num Num,Northwest Territories,Inuvik,dee dee Inuvik NT,,,
Everlasting Faith Child Care Center (EFCC),Northwest Territories,Upper Marlboro,8585 Landover  Road Upper Marlboro NT,Infant Toddler Preschool,3014411642,
Amherst Pre-School Cdc,Nova Scotia,Amherst,1 Ratchford St Amherst NS,Kindergarten,667-7731,
Bright Beginnings Child Care Centre,Nova Scotia,Amherst,25 Park St Amherst NS,Toddler Kindergarten Preschool Schoolage,667-7857,
Cumberland YMCA,Nova Scotia,Amherst,141 Victoria St Amherst NS,Toddler Kindergarten Preschool Schoolage,667-9112,
Cumberland YMCA Child Care Pgm,Nova Scotia,Amherst,92 Church St. Amherst NS,Toddler Kindergarten Preschool,667-9112,
Little Lambs Child Care Centre,Nova Scotia,Amherst,"12 Laplanche Street, Amherst N.S Amherst NS",Toddler Kindergarten Preschool,902-660-3019,
Annapolis Royal Nursery School,Nova Scotia,Annapolis Royal,Rm124 Annapolis Royal NS,Preschool,532-3180,
Good Beginnings Day Care,Nova Scotia,Annapolis Royal,9 Grange St Annapolis Royal NS,Toddler Kindergarten Preschool Schoolage,532-7736,
Lindsay's Little Ones Daycare,Nova Scotia,Annapolis Royal,135 Hwy 201 Annapolis Royal NS,Infant Toddler Kindergarten Preschool Schoolage,(902)532-1516,
Antigonish Playschool,Nova Scotia,Antigonish,77 Highland Dr Antigonish NS,Kindergarten Preschool,863-1750,
Children's Place Day Care Ctr,Nova Scotia,Antigonish,81 Church St Antigonish NS,Toddler Kindergarten Preschool Schoolage,863-4570,
Children's Place Learning Centre,Nova Scotia,Antigonish,19 Brookside Way Antigonish NS,Kindergarten Preschool Schoolage,863-0614,
Cormier's Plan And Learn Centre,Nova Scotia,Antigonish,18 Hillcrest St Antigonish NS,Infant Toddler Kindergarten Preschool Schoolage,902-867-3872,
Lower South River Preschool,Nova Scotia,Antigonish,4 South Side Harbour Antigonish NS,Toddler Kindergarten Preschool Schoolage,863-0514,
Ponderosa Play And Learn,Nova Scotia,Antigonish,17 Highland Dr Extension Antigonish NS,Kindergarten Preschool Schoolage,867-4975,
Ponderosa Play And Learn Ctr,Nova Scotia,Antigonish,15 Ponderosa Dr Antigonish NS,Toddler Kindergarten Preschool,863-4975,
The Red Apple Children's Centre Ltd.,Nova Scotia,Antigonish,12 Carter Cres Antigonish NS,Toddler Kindergarten Preschool Schoolage,863-4357,
Baddeck Nursery School,Nova Scotia,Baddeck,526 Chebucto St Baddeck NS,Preschool,295-2204,
Cathy's Island Preschool,Nova Scotia,Barrington Passage,67 Snows Road Barrington Passage NS,Toddler Kindergarten Preschool,637-3735,
Huggy Bears Child Care Ctr,Nova Scotia,Barrington Passage,3138 Highway 33 Barrington Passage NS,Toddler Kindergarten Preschool Schoolage,637-3198,
Michelle's Nursery School,Nova Scotia,Barrington Passage,Stirl's Road #3782 Barrington Passage NS,Toddler Kindergarten Preschool Schoolage,637-2004,
Ready Set Learn Preschool,Nova Scotia,Barrington Passage,3430 Highway 3 Barrington Passage NS,Toddler Kindergarten Preschool,902-745-2975,
Rachael's Day Care,Nova Scotia,Beaver Bank,Majestic Avenue Beaver Bank NS,Infant Toddler Preschool,902-864-4958,
Big Sunshine Family Daycare,Nova Scotia,Bedford,Aspenhill Court Bedford NS,Infant Toddler Kindergarten Preschool Schoolage,9027029312,
Crestview Children's Centre,Nova Scotia,Bedford,43 Oceanview Drive Bedford NS,Kindergarten Preschool Schoolage,835-4295,
Crestview Children's Centre,Nova Scotia,Bedford,1460A Bedford Hwy Bedford NS,Kindergarten Preschool Schoolage,835-8700,
Dar's Daycare,Nova Scotia,Bedford,173 Hammonds Plains Road Bedford NS,Infant Toddler Kindergarten Preschool,(902) 835-2561,
Home Based Childcare In Bedford NS,Nova Scotia,Bedford,Aspenhill Crt Bedford West Bedford NS,Infant Toddler Kindergarten Preschool Schoolage,902-800-0243,
Judy's Nursery School,Nova Scotia,Bedford,29 Meadowview Dr Bedford NS,Toddler Kindergarten Preschool,835-7029,
Judys Early Learning Preschool,Nova Scotia,Bedford,29 Meadowview Drive Bedford NS,Preschool,9028357929,
Kids And Company,Nova Scotia,Bedford,65 Dellridge Ln. Bedford NS,Infant Toddler Kindergarten Preschool Schoolage,902-832-7902,
Kids And Company Larry Uteck,Nova Scotia,Bedford,"540 Southgate Drive, Unit 100 Bedford NS",Infant Toddler Kindergarten Preschool Schoolage,902-832-7852,
Landsburg Learning Centre,Nova Scotia,Bedford,Landsburg Road Bedford NS,Toddler Kindergarten Preschool,902-456-1523,
Berwick And District Nursery School,Nova Scotia,Berwick,155 Orchard St Berwick NS,Preschool,538-9680,
Count Your Blessings Child Care,Nova Scotia,Berwick,1406 South Bishop Road Berwick NS,Toddler Kindergarten Preschool Schoolage,(902)365-2794,
My Little Family,Nova Scotia,Berwick,302 Main St Berwick NS,Infant Toddler Kindergarten Preschool Schoolage,538-9352,
Orchards Away Day Care,Nova Scotia,Berwick,243 Commercial St. Berwick NS,Toddler Kindergarten Preschool Schoolage,538-7790,
Bridgewater Day Care Centre,Nova Scotia,Bridgewater,87A Hillcrest St Bridgewater NS,Infant Toddler Kindergarten Preschool Schoolage,543-7280,
Cookies 'n Crayons Childcare Ctr,Nova Scotia,Bridgewater,40 Logan Rd Bridgewater NS,Toddler Kindergarten Preschool,543-2627,
Great Big Dreams Daycare,Nova Scotia,Bridgewater,40 Logan Road Bridgewater NS,Toddler Kindergarten Preschool,543-2627,
Small World Learning Centre,Nova Scotia,Bridgewater,115 Pleasant St Bridgewater NS,Kindergarten Preschool Schoolage,543-9840,
Wee Wisdom Nursery School,Nova Scotia,Bridgewater,87 Hillcrest St Bridgewater NS,Preschool,543-1400,
YMCA Lunenburg Co. Child Care Centre,Nova Scotia,Bridgewater,75 High St Bridgewater NS,Toddler Kindergarten Preschool,543-6399,
The Kinder Gaden Preshool,Nova Scotia,Brooklyn,86 Dunlop Road Brooklyn NS,Toddler Kindergarten Preschool Schoolage,902-757-2234,
The Kinder Garden Preschool And Childcare Centre,Nova Scotia,Brooklyn,86 Dunlop Road Brooklyn NS,Infant Toddler Preschool Schoolage,9027572234,
Apple Tree Landing Children's Ctr,Nova Scotia,Canning,1063 Jordan Road Canning NS,Toddler Kindergarten Preschool Schoolage,582-3086,
Canso And Area Day Care Ctr,Nova Scotia,Canso,115 School St Canso NS,Toddler Kindergarten Preschool Schoolage,366-2090,
Chester Kiddie Academy,Nova Scotia,Chester,4036 Highway 3 Chester NS,Kindergarten Preschool,275-4111,
Carrie's Home Daycare,Nova Scotia,Cole Harbour,14 Bissett Rd Cole Harbour NS,Infant Toddler Kindergarten Preschool,902-435-4707,
French Daycare - Garderie Francais,Nova Scotia,Cole Harbour,52 stirling Dr Cole Harbour NS,Infant Toddler Kindergarten Preschool Schoolage,819-668-0225,
Jacquelyn's Childcare,Nova Scotia,Cole Harbour,Ashgrove Ave Cole Harbour NS,Toddler Kindergarten Preschool,,
Lorilee's In Home Child Care,Nova Scotia,Cole Harbour,Amaranth crescent Cole Harbour NS,Infant Toddler Kindergarten Preschool,902-434-9275,
Betty Whelan's Rainbow Preschool,Nova Scotia,Coxheath,31 Mount Florence St Coxheath NS,Toddler Kindergarten Preschool Schoolage,567-2338,
Tiny Town Day Care And Preschool,Nova Scotia,Coxheath,54 Mount Florence St Coxheath NS,Toddler Kindergarten Preschool Schoolage,562-2127,
A Child's World Early Learning Centre,Nova Scotia,Dartmouth,15 Bissett Rd Dartmouth NS,Preschool,462-7606,
