Name,Prov_Terr,City,Address,Age_Groups,Telephone,
Clifford Cooperative Nursery School,Ontario,Clifford,17 Allan Street E Clifford ON,Preschool,519-327-8223,
Clinton Co-Operative Childcare Centre,Ontario,Clinton,165 Princess Street Clinton ON,Toddler Preschool Schoolage,519-482-5777,
ST. JOSEPH'S BEST START,Ontario,Clinton,297 Smith St. N. Clinton ON,Kindergarten Schoolage,519-482-5777,
Tuckersmith Day Nursery,Ontario,Clinton,26 Toronto Blvd Clinton ON,Toddler Preschool Schoolage,519-482-7634,
Cobalt St. Patrick School Early Learning Program,Ontario,Cobalt,119 Lang Street Cobalt ON,Preschool,705-672-2100,
C.r. Gummow YMCA Child Care,Ontario,Cobourg,287 Gravely Street Cobourg ON,Toddler Preschool Schoolage,905-372-9714,
Cobourg Day Care,Ontario,Cobourg,325 Alexander Drive Cobourg ON,Infant Toddler Kindergarten Preschool Schoolage,905-372-9507,
Cobourg YMCA Child Care,Ontario,Cobourg,339 Elgin Street West Cobourg ON,Preschool,905-372-0161,
Cook's Home Child Care Agency,Ontario,Cobourg,172 Queen Street Cobourg ON,Infant Toddler Kindergarten Preschool Schoolage,905-372-2143,
Escuelita Home Daycare,Ontario,Cobourg,County Rd 45 Cobourg ON,Infant Toddler Kindergarten Preschool Schoolage,289-251-6648,
Junior Set Nursery School,Ontario,Cobourg,326 Ball Street Cobourg ON,Preschool,905-372-3756,
Shirley's Home Daycare,Ontario,Cobourg,89 Darcy Street Cobourg ON,Infant Toddler Kindergarten Preschool Schoolage,905-372-8917,
St. Joseph's YMCA Child Care - Northumberland,Ontario,Cobourg,919 D'Arcy Street North Cobourg ON,Kindergarten Preschool,905-372-6444,
St. Peter's Pre-School Learning Centre,Ontario,Cobourg,240 College Street Cobourg ON,Preschool,905-373-1296,
Terry Fox YMCA Child Care,Ontario,Cobourg,1065 Riddell Avenue Cobourg ON,Preschool Schoolage,905-373-4664,
Cochrane Child Care Centre,Ontario,Cochrane,435 Tenth Street Cochrane ON,Toddler Kindergarten Preschool Schoolage,705-272-6092,
Garderie Clin D'oeil - Cochrane,Ontario,Cochrane,399 8iÃ¨me rue Cochrane ON,Toddler Kindergarten Preschool Schoolage,705-272-4393,
Coe Hill Public School Best Start Site,Ontario,Coe Hill,2149 Highway 620 Coe Hill ON,Kindergarten,613-332-0179,
Kyra's Home Daycare,Ontario,Colborne,Burham Ave Colborne ON,Kindergarten Schoolage,905-809-4971,
Little Sprouts At Evergreen,Ontario,Colborne,176 Elm Street Colborne ON,,(289) 273-2283,
A Place To Grow,Ontario,Coldwater,west street Coldwater ON,Infant Toddler Kindergarten Preschool Schoolage,705-6867618,
Buzzy Beez Daycare,Ontario,Coldwater,John street Coldwater ON,Infant Toddler Kindergarten Preschool Schoolage,(705) 812-3878,
Coldwater Cooperative Nursery School,Ontario,Coldwater,20 Gray Street Coldwater ON,Preschool,705-686-3781,
Daphne's,Ontario,Coldwater,Harriet Street Coldwater ON,Toddler Preschool,7056863466,
Elmo's Playhouse,Ontario,Coldwater,223 Medonte Road 2  R. R. #2 Coldwater ON,Infant Toddler Kindergarten Preschool Schoolage,705-835-5747,
Home Care - Alternate-Sick Daycare,Ontario,Coldwater,Harriet Street Coldwater ON,Toddler Kindergarten Preschool Schoolage,705-812-1484,
Lisa O'Hara's Daycare,Ontario,Coldwater,5 Bush Street Coldwater ON,Infant Toddler Kindergarten Preschool Schoolage,705-686-3494,
Collingwood's Little People's Day Care Centre,Ontario,Collingwood,325 Hurontario Street Collingwood ON,Toddler Preschool,705-444-2552,
Little Bear's Christian Daycare,Ontario,Collingwood,20 Courtice Crescent Collingwood ON,Infant Toddler Kindergarten Preschool Schoolage,705-293-2252,
Little House Montessori,Ontario,Collingwood,140 Maple Street Collingwood ON,Toddler Kindergarten Preschool Schoolage,705-444-9997,
Little Wonders,Ontario,Collingwood,Davis St Collingwood ON,,,
Maclean Home Daycare,Ontario,Collingwood,Maclean Ave. COllingwood ON,Infant Toddler Preschool,6475447449,
Maple Lane Nursery School,Ontario,Collingwood,28 Tracey Lane Collingwood ON,Preschool,705-445-0086,
Tots 'n' Tykes Child Care Centre,Ontario,Collingwood,60 Ninth Street Collingwood ON,Toddler Preschool,705-445-5515,
YMCA School Age - Admiral Collingwood Elementary School,Ontario,Collingwood,15 Dey Drive Collingwood ON,Schoolage,705.444.0188,
YMCA School Age - Cameron Street Public School,Ontario,Collingwood,575 Cameron Street Collingwood ON,Schoolage,705.444.0188,
YMCA School Age - Connaught Public School,Ontario,Collingwood,301 Peel Street Collingwood ON,Schoolage,705.444.0188,
Dee's Daycare,Ontario,Concord,New Seabury Drive Concord ON,Infant Toddler Preschool,416-500-3971,
Glen Shields Co-Operative Nursery School,Ontario,Concord,7894 Dufferin Street Concord ON,Preschool,905-886-8466,
Harmonie Montessori School,Ontario,Concord,545 Rivermede Road Concord ON,Toddler Kindergarten Preschool Schoolage,9057601774,
Little HandsAt Play Daycare,Ontario,Concord,411 Confederation Parkway Concord ON,Infant Toddler Kindergarten Preschool Schoolage,9057611227,
Mini-Mozart Home Daycare,Ontario,Concord,Forest run blv Concord ON,Infant Toddler Kindergarten Preschool,905 303 1445,
North Hill Private School,Ontario,Concord,9050 Dufferin Street Concord ON,Toddler Preschool,905-417-9779,
St Joseph The Worker Child Care Centre,Ontario,Concord,206 Glen Shields Avenue Concord ON,Kindergarten Preschool Schoolage,905-660-3527,
St. Joseph The Worker Child Care Centre,Ontario,Concord,206 Glen Shields Avenue Concord ON,Toddler Preschool Schoolage,905-738-5566,
ABC Daycare,Ontario,Coniston,Caruso st Coniston ON,Toddler Kindergarten Preschool,,
Babies And Bears Daycare,Ontario,Coniston,65 Fourth ave Coniston ON,Infant Toddler Kindergarten Preschool Schoolage,705-694-5689,
Garderie Touche-ÃÄ-Tout - Les Petits Chevaliers De La Garderie Touche-ÃÄ-Tout,Ontario,Coniston,2 Edward Avenue Coniston ON,Toddler Preschool Schoolage,705-694-4177,
Teddy Bear Day Care - St. Paul Site,Ontario,Coniston,1 Edward Street N. Coniston ON,Infant Toddler Kindergarten Preschool Schoolage,705-693-5282,
Lily Bugs Daycare,Ontario,Consecon,10 division blvd Consecon ON,Infant Toddler Kindergarten Preschool Schoolage,613-920-4264,
Five Little Monkeys Childcare,Ontario,Cookstown,11th Line Cookstown ON,Toddler Kindergarten Preschool Schoolage,705 458 1525,
Rebecca's Home Away From Home Childcare!,Ontario,Cookstown,wellington st Cookstown ON,Infant Toddler Kindergarten Preschool Schoolage,6472728044,
Snuggle Bear Daycare,Ontario,Cookstown,elizabeth street Cookstown ON,Infant Toddler Preschool,,
TipToes Family Childcare,Ontario,Cookstown,14th Line Cookstown ON,Infant Toddler Kindergarten Preschool Schoolage,4165807229,
Copper Cliff Pre-School Program,Ontario,Copper Cliff,50 School Road Copper Cliff ON,Preschool,705-682-4721,
Kiddie Copper Day Care,Ontario,Copper Cliff,Copper Cliff Copper Cliff ON,Infant Toddler Kindergarten Preschool,919-9357,
Walden Day Care Centre,Ontario,Copper Cliff,50 School Street Copper Cliff ON,Preschool Schoolage,705-692-9306,
A Child's Secret Garden,Ontario,Cornwall,146 Chevrier Avenue Cornwall ON,Infant Toddler Kindergarten Preschool Schoolage,613-936-6730,
Centre Ãâducatif 'la NativitÃ©',Ontario,Cornwall,146 Rue Chevrier Cornwall ON,Infant Toddler Preschool,613-938-0836,
Centre Ãâducatif Horizon-Jeunesse,Ontario,Cornwall,780 Rue Sydney Cornwall ON,Preschool Schoolage,613-936-0889,
Centre Ãâducatif Notre-Dame,Ontario,Cornwall,420 Rue 15iÃ¨me Ouest Cornwall ON,Toddler Kindergarten Preschool Schoolage,613-936-8457,
Centre Ãâducatif Rose Des Vents,Ontario,Cornwall,1650 2e Rue Est Cornwall ON,Preschool,613-936-0761,
Free To Become Before And After School Program,Ontario,Cornwall,200 Amelia Street Cornwall ON,Infant Toddler Kindergarten Preschool Schoolage,613-551-5615,
Kinderhouse Child Care Centre,Ontario,Cornwall,581 Cheryl St. Cornwall ON,Toddler Preschool,613-933-4455,
Le Petit Soleil Bilingual Home Child Care,Ontario,Cornwall,Donald Ave Cornwall ON,Infant Toddler Kindergarten Preschool,613-932-6444,
Richelieu Day Care,Ontario,Cornwall,305 York St Cornwall ON,Toddler Preschool,613-933-5730,
River Front School Age Program,Ontario,Cornwall,1810 Montreal Road Cornwall ON,Toddler Preschool Schoolage,613-363-1732,
ST. JOSEPH'S CHILD CARE CENTRE,Ontario,Corunna,535 Birchbank Drive Corunna ON,Infant Toddler Kindergarten Preschool Schoolage,519-542-0896,
Sunshine Corner Nursery School And Day Care,Ontario,Corunna,249 Clairwood Crescent Corunna ON,Preschool Schoolage,519-862-1265,
Once Upon A Time Child Care Centre,Ontario,Cottam,122 Fox Street Cottam ON,Infant Toddler Preschool Schoolage,519-839-5666,
Once Upon A Time Child Care Centre,Ontario,Cottam,302 County Road 27 Cottam ON,Toddler Preschool Schoolage,519-776-6555,
Angelas Before And After School Care,Ontario,Courtice,simnick cres Courtice ON,Schoolage,9052590389,
Anny's Home Child Care,Ontario,Courtice,Glenabbey Dr Courtice ON,Toddler Preschool,905-240-3670,
Before And After School Care,Ontario,Courtice,24 Bathgate Crescent Courtice ON,Kindergarten Schoolage,289-240-9034,
Clarington Kids,Ontario,Courtice,2950 Courtice Road North Courtice ON,Infant Toddler Preschool Schoolage,905-432-3969,
Daycare Closed,Ontario,Courtice,Hearthstone Cres Courtice ON,,4164395285,
Dr. Emily Stowe Child Care Centre,Ontario,Courtice,71A Sandringham Drive Courtice ON,Preschool Schoolage,905-432-0968,
Dr. G.j. Macgillivray YMCA Schoolage Program,Ontario,Courtice,75 Meadowglade Road Courtice ON,Toddler Preschool Schoolage,905-987-5305,
Good Shepherd School Age Program,Ontario,Courtice,20 Farmington Drive Courtice ON,Toddler Preschool Schoolage,905-432-7630,
Grow With Me Daycare,Ontario,Courtice,Alderbrook Courtice ON,Toddler Preschool,289-404-1248,
Happy Hippo Childcare,Ontario,Courtice,Eastfield Cres Courtice ON,Infant Toddler Kindergarten Preschool Schoolage,905-431-1420,
LORI'S DAY CARE,Ontario,Courtland,191 TALBOT RD COURTLAND Courtland ON,Infant Toddler Kindergarten Preschool Schoolage,519-842-9174,
Safe Clean And Loving!,Ontario,Courtright,116 Templeton Courtright ON,Infant Toddler Kindergarten Preschool Schoolage,519-330-5574,
Teddy Bears Picnic Children's Centre,Ontario,Creemore,6 Elizabeth Street East Creemore ON,Toddler Kindergarten Preschool Schoolage,705-466-2241,
Andrea's Daycare,Ontario,Crysler,Pleasant st Crysler ON,Kindergarten Preschool Schoolage,613 987 2540,
Daycare,Ontario,Crysler,Crysler Crysler ON,,6132987,
Line's Daycare,Ontario,Crysler,Champagne Ext Crysler ON,Infant Toddler Kindergarten Preschool Schoolage,6132951306,
Sue's Home Daycare,Ontario,Crysler,Princess Street Crysler ON,Infant Toddler Preschool,613-875-7300,
Ashley's Daycare,Ontario,Crystal Beach,Fairfield Ave Crystal Beach ON,Infant Toddler,905-714-3528,
Crystal Beach Childcare,Ontario,Crystal Beach,145 Derby Road Crystal Beach ON,Preschool Schoolage,905-894-3900,
Fort Erie YMCA - St. George,Ontario,Crystal Beach,3800 Wellington Road Crystal Beach ON,Kindergarten Schoolage,905-894-1719,
Mom's Care,Ontario,Crystal Beach,150 Derby Road Crystal Beach ON,Toddler Kindergarten Preschool,6473089520,
Just Like Home Daycare,Ontario,Cumberland,1213 arbuste ave Cumberland ON,Infant Toddler Kindergarten Preschool Schoolage,613 833 1573,
"La Coccinelle, Arc-En-Ciel",Ontario,Cumberland,1830 Promenade Portobello Cumberland ON,Kindergarten Preschool Schoolage,613-841-4034,
Orleans Montessori Children's House,Ontario,Cumberland,1212 Arbuste Avenue Cumberland ON,Preschool,613-833-1442,
Cumberland Beach Daycare,Ontario,Cumberland Beach,3388 Lee Ave Cumberland Beach ON,Infant Toddler Kindergarten Preschool,705-241-3508,
Children's Junction,Ontario,Deep River,51 Poplar Street Deep River ON,Toddler Kindergarten Preschool Schoolage,613-584-4263,
Deep River Nursery School Cooperative,Ontario,Deep River,1 Brockhouse Way Deep River ON,Preschool,613-584-4911,
Children's Laugh And Learn Day Care Of Delhi,Ontario,Delhi,144 Western Avenue Delhi ON,Preschool,519-582-3764,
Delhi Daycare,Ontario,Delhi,2066 hwy 3 delhi ON,Infant Toddler Preschool,226 270 4924,
Diane Bilingual Daycare Services,Ontario,Delhi,Hwy 3 delhi Delhi ON,Infant Toddler Kindergarten Preschool Schoolage,,
Happy Hearts Home Daycare,Ontario,Delhi,Talbot Rd Delhi ON,,403-975-8504,
Lisa's Home Daycare,Ontario,Delhi,236 Harris St. Delhi ON,Infant Toddler Kindergarten Preschool Schoolage,519-582-8234,
Shell's Daycare,Ontario,Delhi,wintergreen Delhi ON,Infant Toddler Preschool,519 582 8690,
Teenies Tots Daycare,Ontario,Delhi,Connaught st Delhi ON,Infant Toddler Kindergarten Preschool Schoolage,5195823187,
Abigail's Best Start Program,Ontario,Deseronto,385 Stanley Street Deseronto ON,Kindergarten Schoolage,613-961-1884,
Close To Home Child And Family Care Centre,Ontario,Deseronto,309 Main Street Deseronto ON,Toddler Preschool Schoolage,613-396-4663,
Eksa O'Kon:A' Child Care Centre,Ontario,Deseronto,R.R.#1 Deseronto ON,Kindergarten Preschool Schoolage,613-967-4401,
Just Like Home,Ontario,Deseronto,Pearl Street Deseronto ON,Toddler Preschool,613-396-1618,
Tahatikonhsotontie Head Start,Ontario,Deseronto,9 Deserontyon Drive Deseronto ON,Preschool,613-396-6716,
Country View Child Care Centre,Ontario,Devlin,195 Highway 613 North Devlin ON,Toddler Preschool Schoolage,807-486-1264,
"Little Hands, Big Hearts Childcare",Ontario,Don Mills,Cassandra Boulevard Don Mills ON,Infant Toddler Preschool,416.903.0216,
CHRISTIAN KID'S CLUB NURSERY SCHOOL,Ontario,Dorchester,4100 Catherine Street Dorchester ON,Preschool,519-671-9442,
Dorchester Child Care,Ontario,Dorchester,Village Gate Crescent Dorchester ON,Infant Toddler Kindergarten Preschool Schoolage,(519)268-3422,
Dorchester Co-Operative Nursery School,Ontario,Dorchester,4065 Catherine Street E. Dorchester ON,Preschool,519-268-7911,
Gisele's  Home  Childcare,Ontario,Dorchester,queen st Dorchester ON,Infant Toddler Kindergarten Preschool Schoolage,519 268 8719,
Kinder Kollege,Ontario,Dorchester,26 Fox Hollow Drive Dorchester ON,Toddler Kindergarten Preschool Schoolage,(226)456 8746,
London Children's Connection,Ontario,Dorchester,3966 Catherine Street Dorchester ON,Toddler Preschool Schoolage,519-268-3432,
Seafield Day Nursery,Ontario,Downsview,100 Yorkgate Blvd. Downsview ON,Infant Toddler Kindergarten Preschool Schoolage,416-663-0596,
Home Away From Home Daycare,Ontario,Drayton,65 Wood St Drayton ON,Infant Toddler,519-638-3402,
Mapleton Preschool,Ontario,Drayton,35 High Street Drayton ON,Preschool,519-638-3331,
Dresden Co-Op Nursery School,Ontario,Dresden,187 Brown Street Dresden ON,Preschool,519-359-7366,
Lambton Rural Child Care,Ontario,Dresden,10923 Countryview Line Dresden ON,Kindergarten,510-882-3480 Ext:24,
Lambton Rural Child Care,Ontario,Dresden,941 North Street Dresden ON,Kindergarten,519-882-3480,
Lambton Rural Child Care,Ontario,Dresden,4587 Bentpath Line Dresden ON,Preschool,519-882-3480 Ext:22,
Dryden Child Care Program,Ontario,Dryden,113 Albert St. Dryden ON,Infant Toddler Preschool Schoolage,807-223-5724,
Dryden Nursery School Cooperative,Ontario,Dryden,91 Rourke Ave. Dryden ON,Preschool,807-223-2433,
K.p. Best Start,Ontario,Dryden,289 Wice Road Dryden ON,Kindergarten Schoolage,807-223-5724,
Pinewood Kid's Connection,Ontario,Dryden,289 Wice Road Dryden ON,Kindergarten Schoolage,807-223-5724,
Riverview Kid's Connection,Ontario,Dryden,20 Davis St. Dryden ON,Kindergarten Schoolage,807-223-5724,
St. Joseph's Best Start,Ontario,Dryden,185 Parkdale Rd. Dryden ON,Kindergarten Schoolage,807-223-5724,
BEST START PROGRAM - ST. PATRICK'S SCHOOL,Ontario,Dublin,94 Mill Street Dublin ON,Kindergarten Schoolage,519-527-0682,
Garderie Educative Du Dubreuilville,Ontario,Dubreuilville,120 Magpie Dubreuilville ON,Preschool,705-884-1496,
Kids 'N Us Child Care,Ontario,Dundalk,251 Young Street Dundalk ON,Infant Toddler Preschool Schoolage,519-923-2182,
Acon Academy,Ontario,Dundas,20 Grant Blvd. Dundas ON,Infant Toddler Preschool,905-902-3879,
Amy's Daycare,Ontario,Dundas,Hunter Dundas ON,Infant Toddler Preschool,905 628 9135,
Cherry Grove Child Care,Ontario,Dundas,Millgrove Sideroad Dundas ON,Infant Toddler Kindergarten Preschool Schoolage,905-975-7665,
Dundas Daycare,Ontario,Dundas,252 Govenors Rd Dundas ON,Infant Toddler,(905) 531-4058,
Dundas Valley Co-op Preschool,Ontario,Dundas,1 Lynndale Drive Dundas ON,Preschool,905-627-9251,
Dundas Valley Montessori School,Ontario,Dundas,108 Park Street West Dundas ON,Preschool,905-627-1073,
Kate's Home Daycare,Ontario,Dundas,20 Hope st dundas ON,Infant Toddler Preschool,289 527 1395,
Laura's Daycare,Ontario,Dundas,McKay Rd Dundas ON,Infant Toddler Kindergarten Preschool,905-628-0342,
Lots Of Laughs,Ontario,Dundas,Carolin Court Dundas ON,Infant Toddler Kindergarten Preschool Schoolage,9056279116,
Michelle Wilson's Daycare,Ontario,Dundas,Creighton Rd Dundas ON,Infant Toddler Preschool Schoolage,905.627.8758,
Children's Learning Workshop,Ontario,Dunnville,223 Lock Street West Dunnville ON,Preschool,905-774-9393,
Little People's Academy,Ontario,Dunnville,254 Robinson Road Dunnville ON,Infant Toddler Kindergarten Preschool Schoolage,905-774-7464,
"Ready, Set, School",Ontario,Dunnville,121 Alder Street Dunnville ON,Preschool,905-541-0682,
Durham Nursery School,Ontario,Durham,185 George Street West Durham ON,Toddler Preschool,519-369-6973,
Kids 'N Us Child Care,Ontario,Durham,575 Saddler Street East Durham ON,Toddler Preschool Schoolage,519-986-3692,
Dutton Co-Operative Child Care,Ontario,Dutton,239 Miller Street Dutton ON,Kindergarten Schoolage,519-762-2399,
Dutton Co-Operative Child Care,Ontario,Dutton,3 Lions Road Dutton ON,Infant Toddler Preschool,519-762-2399,
Irwin Memorial After School Program,Ontario,Dwight,1011 Dwighrt Bay Road Dwight ON,Kindergarten Schoolage,705-645-2229,
Child's View Day Nursery,Ontario,Ear Falls,43 Balsam Ave. So. Ear Falls ON,Preschool,807-222-3462,
Garderie Abc,Ontario,Earlton,10e Rue Ouest Earlton ON,Infant Toddler Kindergarten Preschool Schoolage,705-647-5775 Ext:222,
Charlene's Home Childcare,Ontario,East Gwillimbury,"Mount Albert Road, Sharon east gwillimbury ON",Toddler Kindergarten Preschool Schoolage,647 955-9468,
L'AFRYmousse,Ontario,East Gwillimbury,19300 Second Concession East Gwillimbury ON,Toddler Kindergarten Preschool Schoolage,2899261401,
Saide's Home Daycare,Ontario,East Gwillimbury,87 Thatcher Crescent East Gwillimbury ON,Infant Toddler,9052516515,
Cathy's Home Daycare,Ontario,East York,Peard Road East York ON,,416-285-7114,
Dawn's Home Daycare,Ontario,East York,75 Halsey Ave apt 611 East York ON,Infant Toddler Kindergarten Preschool Schoolage,416 220 7919,
Love And Learn Daycare,Ontario,East York,woodbine ave East York ON,Infant Toddler Preschool,6472055080,
Rocio's Daycare,Ontario,East York,Coleridge Ave. East York ON,Infant Toddler Kindergarten Preschool,4164218140,
Shannon's Home Daycare,Ontario,East York,St. Clair Ave E East York ON,Infant Toddler Preschool,4165245363,
Teresa's Home Daycare,Ontario,East York,85 Galbraith Ave. East York ON,Infant Toddler Kindergarten Preschool Schoolage,416-755-4720,
"Victoria Education Centre, Montessori Child Care - East York",Ontario,East York,1038 Woodbine Avenue East York ON,Toddler Kindergarten Preschool,416-422-5550,
Child Care Algoma,Ontario,Echo Bay,290 Church Street Echo Bay ON,Toddler Preschool,705-945-8898,
Jody's Private Home Daycare,Ontario,Eganville,John Street Eganville ON,Infant Toddler Kindergarten Preschool Schoolage,613 401-5741,
Ketcha Star Day Care,Ontario,Eganville,64 Maple Street Eganville ON,Kindergarten Preschool Schoolage,613-628-1657,
Li'l Apples Acres Daycare,Ontario,Eganville,675 Royal Pines Road Eganville ON,Infant Toddler Kindergarten Preschool Schoolage,613-401-9927,
Lisa Agnew's Home Child Care,Ontario,Eganville,Wellington St Eganville ON,Infant Toddler Kindergarten Preschool Schoolage,613.628.9222,
Robin's Home Child Care,Ontario,Eganville,Queen Eganville ON,Infant Toddler,613-628-5204,
Elgin And District Cooperative Nursery School,Ontario,Elgin,77 Main Street Elgin ON,Preschool,613-359-6611,
Claire Dimock Children's Centre,Ontario,Elliot Lake,12 Westhill Road Elliot Lake ON,Infant Toddler Preschool Schoolage,705-848-9545,
Garderie Des Petits Amis,Ontario,Elliot Lake,140 Hillside Dr. N. Elliot Lake ON,Infant Toddler Preschool Schoolage,705-848-4747,
Garderie Petit Tresor,Ontario,Elliot Lake,160 Spruce Street Elliot Lake ON,Preschool,705-848-7591,
Little Treasures Children's Centre,Ontario,Elliot Lake,160 Spruce Street Elliot Lake ON,Infant Toddler Preschool Schoolage,705-848-4904,
Elmira Children's Centre,Ontario,Elmira,22 Mockingbird Drive Elmira ON,Toddler Kindergarten Preschool,519-669-8411,
Elmira Community Nursery School,Ontario,Elmira,250 William St. Elmira ON,Toddler Preschool,519-669-2609,
Sweet Dreams Baby Care,Ontario,Elmira,Bristow Creek Drive Elmira ON,Infant Toddler Kindergarten Preschool,519-957-2257,
Elmvale Co-Operative Nursery School,Ontario,Elmvale,27 Yonge Street South Elmvale ON,Preschool,705-790-4339,
ABC Home Daycare,Ontario,Elora,colborne street Elora ON,Infant Toddler Kindergarten Preschool Schoolage,519-265-5027,
Elora Home Daycare,Ontario,Elora,Carlton PL Elora ON,Infant Toddler Preschool,519-546-8917,
Little Angels Development-Elora,Ontario,Elora,30 Geddes St. Elora ON,Toddler Kindergarten Preschool,519-846-1276,
Mother's Children,Ontario,Elora,Wilson Cresent Elora ON,Kindergarten Schoolage,519 846 2737,
Zorra Highland School Age Program,Ontario,Embro,R.r. # 1 Embro ON,Toddler Preschool Schoolage,519-475-4121,
Cambridge Circle Of Friends,Ontario,Embrun,2123 Route 500 Embrun ON,Preschool Schoolage,613-443-4428,
Centre Ãâducatif Du TrÃ©sor,Ontario,Embrun,964 Notre Dame Embrun ON,Toddler Kindergarten Preschool Schoolage,613-443-1414,
Debby's Daycare,Ontario,Embrun,Fleurette Street Embrun ON,Infant Toddler,6134431197,
Garderie Chez Angel's Daycare,Ontario,Embrun,Lapointe blvd Embrun ON,Toddler Kindergarten Preschool Schoolage,613-914-3875,
Garderie Des Amis,Ontario,Embrun,1081 Rue Notre-Dame Embrun ON,Toddler Preschool Schoolage,613-443-0643,
Grow Soo Fast,Ontario,Embrun,dignard st Embrun ON,Infant Toddler Kindergarten Preschool Schoolage,613-370-0899,
Happy All Day Daycare,Ontario,Embrun,61 lamadeleine blvd Embrun ON,Infant Toddler Kindergarten Preschool Schoolage,613- 370-0200,
Hugs And Tugs Home Daycare,Ontario,Embrun,Lachaine st Embrun ON,Infant Toddler Preschool,6138686173,
Jo-Ann's Penguin Hands Private Daycare,Ontario,Embrun,6 Cecile Street Embrun Ontario Embrun ON,Infant Toddler Kindergarten Preschool Schoolage,613-443-5240,
Lakeshore Township Community Daycare Centre,Ontario,Emeryville,1201 Church St. Emeryville ON,Kindergarten Schoolage,519-727-3711,
Your Wooden Treehouse Day Care,Ontario,Emeryville,1204 County Road 22 Emeryville ON,Infant Toddler Preschool Schoolage,519-727-8939,
Evergreen After School Program,Ontario,Emsdale,2510 Highway 592 N. Emsdale ON,Kindergarten Schoolage,705-746-7777,
Highlands Children's Centre,Ontario,Emsdale,Hwy 592 North Emsdale ON,Toddler Kindergarten Preschool Schoolage,705-636-0202,
Englehart And Area Child Care Centre,Ontario,Englehart,80 8th Avenue Englehart ON,Toddler Kindergarten Preschool Schoolage,705-544-2448,
Temiskaming Wee Care Day Care,Ontario,Englehart,80 4th Street Englehart ON,Toddler Kindergarten Preschool Schoolage,705-544-2186,
Timiskaming Brighter Futures Preschool,Ontario,Englehart,40 3rd Avenue Englehart ON,Toddler Preschool,705-567-9201,
Amys Daycare,Ontario,Erin,Sandalwood Dr Erin ON,Infant Toddler Kindergarten Preschool Schoolage,4168980546,
Appleseed Child Care Centre,Ontario,Erin,9 Main Street Erin ON,Toddler Preschool,519-855-6340,
Appleseed Child Care Centre,Ontario,Erin,185 Daniel Street Erin ON,Toddler Preschool Schoolage,519-833-9685 Ext:411,
Appleseed Child Care Centre,Ontario,Erin,9426 Wellington Road Erin ON,Toddler Preschool Schoolage,519-833-0994,
Station Road Co-Op. Nursery School,Ontario,Erin,14 Boland Drive Erin ON,Preschool,519-833-2882,
All Star Children Services,Ontario,Espanola,333 Boulevard Mead Espanola ON,Preschool Schoolage,705-848-4800,
"Our Children, Our Future-Nos Enfants, Notre Avenir",Ontario,Espanola,273 Mead Blvd. Espanola ON,Kindergarten Preschool Schoolage,705-677-0440,
The One Tot Stop Day Care,Ontario,Espanola,128 Park Street Espanola ON,Preschool Schoolage,705-869-3282,
First Steps Child Care,Ontario,Essex,169 Irwin Avenue Essex ON,Infant Toddler Kindergarten Preschool Schoolage,519-776-6863,
Once Upon A Time Child Care Centre,Ontario,Essex,200 Fairview Ave. W. Essex ON,Toddler Kindergarten Preschool,519-776-6555,
Story Book Early Learning Centre,Ontario,Essex,492 County Rd. 8 Essex ON,Kindergarten Schoolage,519-776-5044,
Story Book Early Learning Centre,Ontario,Essex,26 Arthur Avenue Essex ON,Infant Toddler Kindergarten Preschool,519-776-7772,
Munchkinz Preschool,Ontario,Etobicoke,260 The Queensway Etobicoke ON,Toddler Preschool,(416) 252-0600,
!UDO Home Daycare,Ontario,Etobicoke,11 Hargrove Lane Etobicoke ON,Infant Toddler Kindergarten Preschool,647-200-9171,
Alma's Home Daycare,Ontario,Etobicoke,Richiview Rd Etobicoke ON,Infant Toddler Preschool,(416) 389 1095,
BABY QUEEN,Ontario,Etobicoke,the east mall Etobicoke ON,Toddler Kindergarten Preschool Schoolage,6475715701,
Blue Feather Daycare,Ontario,Etobicoke,22 Windsor St. Etobicoke ON,Infant Toddler Kindergarten Preschool,647-351-7176,
Bright Infinite Child Care,Ontario,Etobicoke,Twenty Ninth Street Etobicoke ON,Toddler Preschool,647 3007878,
Brighton Child Care,Ontario,Etobicoke,Ash Cres. Etobicoke ON,Infant Toddler Preschool,6472072329,
Caterpillar And Co.,Ontario,Etobicoke,55 Chauncey Avenue Etobicoke ON,Infant Toddler Kindergarten Preschool,416-239-2888,
Children's Casa Montessori School,Ontario,Etobicoke,Carsbrooke Rd Etobicoke ON,Kindergarten Schoolage,416-523-1565,
Dana Home Daycare,Ontario,Etobicoke,Islington Ave. Etobicoke ON,Infant Toddler Preschool,416 234 8839,
Doodlebear,Ontario,Etobicoke,Thornbush Crescent Etobicoke ON,Infant Toddler Preschool,6473933244,
