Name,Prov_Terr,City,Address,Age_Groups,Telephone,
Amanda's Home Daycare,Ontario,Oro-medonte,Queen Street Oro-medonte ON,Infant Toddler Kindergarten Preschool Schoolage,(705) 487-7408,
Harbourwood Child Care,Ontario,Oro-medonte,Oro Station Oro-Medonte ON,Infant Toddler Kindergarten Preschool Schoolage,705-716-9238,
Oro Home Daycare,Ontario,Oro-medonte,Please Inquire Oro-medonte ON,Infant Toddler Kindergarten Preschool Schoolage,please email,
Victoria's Daycare,Ontario,Oro-medonte,Line 11 South Hawkestone Oro-Medonte ON,Infant Toddler Kindergarten Preschool Schoolage,705-715-4443,
Ellen's Daycare,Ontario,Orono,Andrews Rd Orono ON,Infant Toddler Kindergarten Preschool Schoolage,905-983-5479,
Kelderman's Kiddies,Ontario,Orono,Main Street Orono ON,Kindergarten Schoolage,289-240-4775,
Emily Kelly- Home Daycare Provider,Ontario,Osgoode,Second Line Road Osgoode ON,Toddler Kindergarten Preschool Schoolage,613-826-5048,
Osgoode Kiddie Care,Ontario,Osgoode,Robert Dowd Street Osgoode ON,Toddler Kindergarten Preschool,613-324-1893,
Rebecca Johnstone's Home Daycare,Ontario,Osgoode,Osgoode Main St Osgoode ON,Toddler Kindergarten Preschool Schoolage,613-371-7512,
The Learning Beehive,Ontario,Oshawa,Concordia Court Oshawa ON,Infant Toddler Kindergarten Preschool Schoolage,905-721-9588,
Marlene's Little League,Ontario,Oshawa,Bernhard Cres Oshawa ON,Infant Toddler Kindergarten Preschool Schoolage,905 434 6867,
Bright Beginnings Childcare,Ontario,Oshawa,Oshawa Blvd S Oshawa ON,Infant Toddler,9052434467,
A CHILD CARE HOME,Ontario,Oshawa,HARLSTONE CRESCENT Oshawa ON,Kindergarten Schoolage,647-705-7511,
A Great Home Daycare,Ontario,Oshawa,Grierson Street Oshawa ON,Infant Toddler Kindergarten Preschool Schoolage,289-240-3052,
A Place To Grow !,Ontario,Oshawa,Sagebrush Oshawa ON,Infant Toddler Kindergarten Preschool Schoolage,905-433-0498,
ABC Daycare,Ontario,Oshawa,Grandview St. N Oshawa ON,Kindergarten Preschool,289-675-0675,
ABC It's Easy As 123 Home Daycare,Ontario,Oshawa,Bridgeport st Oshawa ON,Infant Toddler Kindergarten Preschool,2892748828,
Alana's Babysitting And Childcare,Ontario,Oshawa,Lochness Crescent Oshawa ON,Infant Toddler Preschool,416-879-8390,
All Smiles Day Care,Ontario,Oshawa,100 Taunton Rd East Oshawa ON,Infant Toddler Kindergarten Preschool Schoolage,9057200281,
Arc-en-ciel Home Daycare (Bilingual),Ontario,Oshawa,Oshawa Blvd North Oshawa ON,Infant Toddler Preschool,289-685-6805,
Babies 'N' Blocks,Ontario,Oshawa,199 Wentworth Street West Oshawa ON,Preschool,905-432-2632,
Barb's Buzy Beez Home Daycare,Ontario,Oshawa,Olive Oshawa ON,Infant Toddler Kindergarten Preschool Schoolage,905-743-0546,
Jill's Place Home Daycare,Ontario,Ottawa,Allison Ave Ottawa ON,Kindergarten Preschool,,
Centretown Home Daycare,Ontario,Ottawa,lyon street Ottawa ON,Infant Toddler Preschool,,
100 Acre Woods,Ontario,Ottawa,Haig Dr. Ottawa ON,Infant Toddler Kindergarten Preschool Schoolage,613-521-7670,
2MAINS D'AMOUR AM-PM HOME DAY CARE - GARDERIE EN MILIEU FAMILIAL,Ontario,Ottawa,Agincourt road Ottawa ON,Infant Toddler Kindergarten Preschool Schoolage,613 400 2827,
5 Little Monkeys Daycare And Preshool,Ontario,Ottawa,Colman St K1V 8J9 Ottawa ON,Infant Toddler Preschool,613-203-1684,
A Mothers Love Teachers Daycare,Ontario,Ottawa,Dundonald Drive Ottawa ON,Infant Toddler Kindergarten Preschool Schoolage,613-491-0467,
Abuelita's Daycare,Ontario,Ottawa,73 Drouin ave Ottawa ON,Infant Toddler,6136141483,
AcadeKidz,Ontario,Ottawa,1010 Morrison drive suite 201 Ottawa ON,Infant Toddler Kindergarten Preschool,613-721-3872,
AF Childcare,Ontario,Ottawa,woodridge crescent Ottawa ON,Infant Toddler Kindergarten Preschool Schoolage,613-3026431,
After School Care (Agincourt Public School),Ontario,Ottawa,Whitmore ave Ottawa ON,Kindergarten Schoolage,613-228-2220,
Agus Sanchez Daycare,Ontario,Ottawa,Booth Street Ottawa ON,Infant Toddler,6138059606,
Ali's Jolly Daycare,Ontario,Ottawa,2087 ASSOMPTION Ottawa ON,Infant Toddler Kindergarten Preschool Schoolage,613-408-4446,
Happy Hearts Daycare,Ontario,Paris,Bayly Dr. Paris ON,Infant Toddler Kindergarten Preschool Schoolage,519-442-6800,
Jenny's Jungle,Ontario,Paris,24 Dundas st West Paris ON,Toddler Preschool,5193020777,
Adrienne's Home Daycare,Ontario,Pefferlaw,Waterfront rd Pefferlaw ON,Infant Toddler Kindergarten Preschool Schoolage,905 955 5220,
Hopscotch Home Daycare Agency,Ontario,Pefferlaw,Lakeridge Rd Pefferlaw ON,Infant Toddler Kindergarten Preschool Schoolage,289-466-1111,
Caterpillar Clubhouse,Ontario,Pembroke,Hunter st Pembroke ON,Infant Toddler Preschool,613-735-3013,
Early Bird Daycare,Ontario,Pembroke,Maple ave. Pembroke ON,Kindergarten Preschool,613-732-0810,
Earlybird Daycare,Ontario,Pembroke,Maple Ave Pembroke ON,Toddler Kindergarten Preschool Schoolage,732-0810,
Kitty's Daycare,Ontario,Pembroke,Deep River Pembroke ON,Infant Toddler Preschool,613-584-3989,
Learning Tree Home Daycare,Ontario,Pembroke,Clemow Av Pembroke ON,Infant Toddler Preschool,613-735-5458,
Little Stars Home Daycare,Ontario,Pembroke,Catherine St. Pembroke ON,Infant Toddler Preschool,613-732-3504,
Guardian Angels Daycare,Ontario,Penetanguishene,Robert st West Penetanguishene ON,Infant Toddler Kindergarten Preschool Schoolage,705-549-6332,
Little Caterpillars Preschool And Early Learning Centre,Ontario,Penetanguishene,Main St Penetanguishene ON,Toddler Kindergarten Preschool Schoolage,7055495083,
Mini Munchkins Playhouse,Ontario,Penetanguishene,Levi Simon Trail Penetanguishene ON,Infant Toddler,705-529-4745,
Tracy's Home Child Care,Ontario,Penetanguishene,Chatham Street Penetanguishene ON,Infant Toddler Preschool,705527-3801,
Chez Le Valley Des Petit Bison,Ontario,Perth,concession 5b Perth ON,Infant Toddler Kindergarten Preschool Schoolage,613-218-5977,
Jennifer's Home Care,Ontario,Perth,Sherbrooke St E Perth ON,Toddler Kindergarten Preschool Schoolage,6134642993,
Bright Beginnings,Ontario,Petawawa,Peter Street Petawawa ON,Toddler Kindergarten Preschool Schoolage,6136850636,
Endless Adventures,Ontario,Petawawa,Sandstone Cres Petawawa ON,Infant Toddler Preschool,6136870936,
Felicia's Fun Home DayCare,Ontario,Petawawa,Briarwood Drive Petawawa ON,Infant Toddler Kindergarten Preschool Schoolage,613-639-2723,
Mommy Day Care,Ontario,Petawawa,John Street Petawawa ON,Infant Toddler Kindergarten Preschool Schoolage,613-506-5065,
The Wishing Pond Home Child Care Service,Ontario,Petawawa,Silke Drive Petawawa ON,Infant Toddler Kindergarten Preschool,613-687-9354,
The Wishing Pond Home Childcare Service,Ontario,Petawawa,Silke Drive Petawawa ON,Infant Toddler Kindergarten Preschool Schoolage,613-687-9354,
Tiny Toes Home Daycare,Ontario,Petawawa,First Avenue Petawawa ON,Infant Toddler Kindergarten Preschool Schoolage,6137320265,
Cornerstone Montessori Academy,Ontario,Peterborough,150 O'Carroll Avenue Peterborough ON,Toddler Kindergarten Preschool,(705)874~2545,
Daphne's Home Daycare,Ontario,Peterborough,Bramble Rd. Peterborough ON,Infant Toddler Kindergarten Preschool,(705) 876-9987,
Dar's Daycare,Ontario,Peterborough,Wintergreen Trail Peterborough ON,Infant Toddler Kindergarten Preschool Schoolage,705 742-3592,
Dolphin Day-care,Ontario,Peterborough,487 Montcalm Drive Peterborough ON,Toddler Kindergarten Preschool Schoolage,705-745-4877,
Downie Daycare,Ontario,Peterborough,536 Downie St Peterborough ON,Infant Toddler Preschool,705-930-7253,
Hopes And Dreams,Ontario,Peterborough,Denne Cres Peterborough ON,Infant Toddler Kindergarten Preschool Schoolage,705-740-3006,
Julia's Home Child Care,Ontario,Peterborough,Ridgetop Cres. Peterborough ON,Infant Toddler Preschool,705-741-4018,
Julie's Home Daycare,Ontario,Peterborough,700 Parkhill Rd W Peterborough ON,Infant Toddler Kindergarten Preschool Schoolage,705-749-3347,
Kim's Home Daycare,Ontario,Peterborough,Maxwell Ave. Peterborough ON,Infant Toddler Preschool,705-559-2323,
Learn And Grow Daycare,Ontario,Peterborough,Laurie Avenue Peterborough ON,Schoolage,9054357232,
"Karen KK Home Daycare, Pickering",Ontario,Pickering,strouds lane Pickering ON,Infant Toddler Kindergarten Preschool,905-550-9267,
Ashley's Childcare,Ontario,Pickering,Rosebank Rd Pickering ON,Infant Toddler Kindergarten Preschool,905 492 0417,
A Home Away From Home,Ontario,Pickering,688 Amaretto Ave Pickering ON,Infant Toddler Kindergarten Preschool Schoolage,416 565 3440,
A Home Away From Home,Ontario,Pickering,Belinda crt Pickering ON,Infant Toddler Kindergarten Preschool Schoolage,905-999-1265,
Annette's Home Daycare,Ontario,Pickering,pine grove ave Pickering ON,Kindergarten Preschool Schoolage,905 509-2308,
Ashley's Childcare,Ontario,Pickering,Rosebank Rd Pickering ON,Infant Toddler Kindergarten Preschool,905 492 0417,
Bumble Bee Daycare,Ontario,Pickering,Lublin Ave Pickering ON,Infant Toddler Kindergarten Preschool Schoolage,9054245548,
Cathy's Childcare,Ontario,Pickering,Toynevale Road Pickering ON,Infant Toddler Preschool,905-509-7555,
Chelsea's Daycare,Ontario,Pickering,Sandhurst Crescent Pickering ON,Schoolage,6479993784,
Cherish Your Child,Ontario,Pickering,Pine Grove Avenue Pickering ON,Infant Toddler Kindergarten Preschool Schoolage,416 564 3686,
Chez-Vous Bilingual Daycare,Ontario,Pickering,Wildwood Crescent Pickering ON,Infant Toddler Preschool,647-987-8967,
Chickadee Park Home Daycare,Ontario,Pickering,379 Chickadee Court Pickering ON,Infant Toddler Preschool,647-230-7775,
Garderie Arc-en-ciel,Ontario,Plantagenet,617 county rd 9 Plantagenet ON,Infant Toddler Preschool,613-673-4734,
Jump For Joy Daycare,Ontario,Port Colborne,Hillcrest Road Port Colborne ON,Infant Toddler Kindergarten Preschool Schoolage,905 834 1084,
Muchkins Home Child Care,Ontario,Port Colborne,Cross Street Port Colborne ON,Infant Toddler Kindergarten Preschool Schoolage,905-835-1865,
Stepping Stones At Evergreen Academy,Ontario,Port Colborne,Elm St Port Colborne ON,Toddler Kindergarten Preschool,289-273-2283,
Lynnes After School Care,Ontario,Port Credit,helene St. N Port Credit ON,Kindergarten Schoolage,416-898-6946,
Port Elgin Montessori Preschool,Ontario,Port Elgin,Port Elgin Port Elgin ON,Toddler Kindergarten Preschool,519-386-8087,
Just Like Home Daycare,Ontario,Port Hope,Smith St. Port Hope ON,Infant Toddler Kindergarten Preschool,905 885 9094,
Paula's Home Daycare,Ontario,Port Hope,Spicer St Port Hope ON,Infant Toddler Kindergarten Preschool Schoolage,905-885-4198,
Rikki's Home Daycare,Ontario,Port Hope,County RD 2 Port Hope ON,Infant Toddler Kindergarten Preschool Schoolage,905 431 4252,
Lilybug Learning,Ontario,Port Perry,Kent Street Port Perry ON,Infant Toddler Kindergarten Preschool,905-982-2739,
Little Helpers,Ontario,Port Perry,Bay Street Port Perry ON,Infant Toddler Kindergarten Preschool Schoolage,905 985-9707,
Tiffany's Home Daycare,Ontario,Port Perry,Blossom Court Port Perry ON,Infant Toddler Preschool,,
BlueSky Home Daycare,Ontario,Port Robinson,Biggar Rd. Port Robinson ON,Infant Toddler Kindergarten Preschool,905-384-1751,
Tammy's Daycare,Ontario,Portland,Thousand Acre rd Portland ON,Toddler,613-627-4472,
Monking Around,Ontario,Prescott,4652 4th concession rd Prescott ON,Infant Toddler Kindergarten Preschool Schoolage,(613)925-3985,
Leaps And Bounds Children's Centre- Renfrew,Ontario,Renfrew,Bolger Lane Renfrew ON,Toddler Kindergarten Preschool Schoolage,613-432-2828,
Child's Paradise Day Care,Ontario,Renfrew,450 O'Brien Rd Renfrew ON,Toddler Kindergarten Preschool Schoolage,613-432-2627,
Leaps And Bounds Children's Centre- Renfrew,Ontario,Renfrew,Bolger Lane Renfrew ON,Toddler Kindergarten Preschool Schoolage,613-432-2828,
The Giggle Patch,Ontario,Renfrew,251 Plaunt Street S Renfrew ON,Infant Toddler Kindergarten Preschool,613-433-3133,
Mahnaz's Daycare,Ontario,Richmond Hill,Elmwood Ave Richmond Hill ON,Infant Toddler Kindergarten Preschool,4164945898,
Acre Wood Daycare,Ontario,Richmond Hill,Lark Crescent Richmond Hill ON,Infant Toddler Preschool,6132524833,
Angels,Ontario,Richmond Hill,0000000 richmond hill ON,Infant,,
Childventures Early Learning Academy - Richmond Hill,Ontario,Richmond Hill,10775 Leslie Street Unit 4 Richmond Hill ON,Infant Toddler Kindergarten Preschool Schoolage,905-737-5505,
Corrie's Corner Home Daycare,Ontario,Richmond Hill,Browndale Cres. Richmond Hill ON,Infant Toddler Kindergarten Preschool Schoolage,416-275-2756,
Duck Duck Goose Home Daycare,Ontario,Richmond Hill,52 Maffey Cres Richmond Hill ON,Infant Toddler Kindergarten Preschool Schoolage,416-846-7525,
Early Years Childcare Centers,Ontario,Richmond Hill,163 King Road Richmond Hill ON,Infant Toddler Kindergarten Preschool,289-234-2700,
Early Years Daycare And Learning Centre,Ontario,Richmond Hill,11130 Yonge Street Richmond Hill ON,Infant Toddler Kindergarten Preschool Schoolage,905-727 8105,
Grosvenor Montessori School,Ontario,Richmond Hill,33 Arnold Crescent Richmond Hill ON,Infant Toddler Kindergarten,416.639.5654,
Handprints Montessori Daycare,Ontario,Richmond Hill,Canterbury crt Richmond Hill ON,Kindergarten Preschool Schoolage,(905) 508-6025,
Helpful Care In-Home Services,Ontario,Richmond Hill,Maple Grove Avenue Richmond Hill ON,Infant Toddler Kindergarten Preschool Schoolage,4165619652,
Precious Angels Day Care,Ontario,Roblin,796 cty rd 12 Roblin ON,Infant Toddler Preschool,6135300845,
Abby's Day Home,Ontario,Rockland,Bonavista Street Rockland ON,Schoolage,,
Belindas' Childcare Centre,Ontario,Rockland,1695 St Laurent St Rockland ON,Toddler Kindergarten Preschool Schoolage,(613)419-1181,
Bright Beginnings Home Daycare,Ontario,Rockland,Catherine Street Rockland ON,Infant Toddler Kindergarten Preschool Schoolage,6138673196,
Elisha's Daycare,Ontario,Rockland,Trillium Place Rockland ON,Infant Toddler Preschool,6138527647,
Kiddiecare Rockland,Ontario,Rockland,Laviolette st. Rockland ON,Infant Toddler Kindergarten Preschool Schoolage,613-617-3266,
Nico's Daycare,Ontario,Rockland,209 Topaze Crescent Rockland ON,Infant Toddler,(613)419-0978,
Oops And Ohoh Day Care,Ontario,Rockland,woods street Rockland ON,Infant Toddler Preschool,613-796-0588,
Pitter Patter Playhouse,Ontario,Rockland,1231 Caron Street Rockland ON,Infant Toddler Kindergarten Preschool Schoolage,613-419-1205,
Shannon's Sweet Peas,Ontario,Rockland,Jasper Cres. Rockland ON,Infant Toddler Preschool,,
Jaime's Daycare,Ontario,Rockwood,Hampson Cresent Rockwood ON,Toddler Kindergarten Preschool Schoolage,519-856-0777,
Ashley's Home Daycare,Ontario,Russell,15 George St Russell ON,Infant Toddler Kindergarten Preschool Schoolage,613-282-0094,
Beth's Home Daycare,Ontario,Russell,943 eadie Road Russell ON,Infant Toddler Preschool,613-445-9995,
Kenzie   Friends Home Daycare,Ontario,Russell,Phair Court Russell ON,Toddler,613-618-1438,
La Garderie De Marie-Lou,Ontario,Russell,Groves rd Russell ON,Infant Toddler Kindergarten Preschool Schoolage,613-445-2610,
Pam's Family Daycare,Ontario,Russell,Maple Street Russell ON,Toddler Preschool,,
Rebecca Lynn Daycare,Ontario,Russell,Kinnaird Street Russell ON,Infant Toddler Kindergarten Preschool Schoolage,6134968140,
Reeann's Home Daycare,Ontario,Russell,Route 400 Russell ON,Infant Toddler Kindergarten Preschool,613-445-0233,
Tania's Home Daycare,Ontario,Russell,401 Bouchard Street Russell ON,Infant Toddler Preschool,61-445-1855,
Tiny Toes Daycare,Ontario,Russell,Macdougall Street Russell ON,Infant Toddler Preschool Schoolage,6139835305,
Vikki's Home Daycare,Ontario,Russell,12 Heritage Rd Russell ON,Infant Toddler Kindergarten Preschool Schoolage,6134960222,
Aamjiwnaang First Nation,Ontario,Sarnia,1900 Virgil Ave Sarnia ON,Infant Toddler Preschool,519-344-4132,
Beacons Of Light Daycare,Ontario,Sarnia,297 Stuart Street Sarnia ON,Kindergarten Preschool Schoolage,(519) 337-8906,
Bonjour My Friends! Home Daycare,Ontario,Sarnia,Copland Rd Sarnia ON,Infant Toddler Kindergarten Preschool Schoolage,519-381-0627,
C.A.C.H.E. Child Care Services,Ontario,Sarnia,1240 Murphy Road Sarnia ON,Toddler Preschool,(519) 542-3471 ex 231,
Coronation Park Day Nursery,Ontario,Sarnia,1014 Oak Avenue Sarnia ON,Infant Toddler Kindergarten Preschool,(519) 344-9601,
First Base School Program - Cathcart School,Ontario,Sarnia,1219 Cathcart Blvd Sarnia ON,Kindergarten Schoolage,(519) 336-9622 rx237,
King's Kids Nursery,Ontario,Sarnia,1565 London Line Sarnia ON,Preschool,(519) 542-7731,
Lambton Rural Child Care,Ontario,Sarnia,161 Kendall St Sarnia ON,Infant Toddler Kindergarten Preschool Schoolage,519-882-3480,
LC,Ontario,Sarnia,does not exist Sarnia ON,Infant Toddler Kindergarten Preschool,,
Lilly Bugs Home Daycare,Ontario,Sarnia,N. Mitton Street Sarnia ON,Infant Toddler Kindergarten Preschool Schoolage,226-932-5771,
Good Family Daycare,Ontario,Sault Ste. Marie,Rowell Ave. Sault Ste. Marie ON,Toddler Preschool,705-945-7774,
Good Family Daycare,Ontario,Sault Ste. Marie,Franklin Sault Ste. Marie ON,Toddler Preschool,705-945-7774,
Hilltop Childcare,Ontario,Sault Ste. Marie,113 Panoramic Drive Sault Ste. Marie ON,Infant Toddler Kindergarten Preschool Schoolage,7059496571,
Tania's Daycare,Ontario,Sault Ste. Marie,21 Wawanosh Ave Sault Ste. Marie ON,Toddler Preschool,705-943-7622,
' Home Away From Home'  Infant Childcare,Ontario,Scarborough,Toynbee Trail Scarborough ON,Infant Toddler,416-284-5227,
'Home Away From Home ' Daycare,Ontario,Scarborough,Toynbee Trail Scarborough ON,Infant Toddler,416-284-5227,
5 Lucky Duckies Day Care,Ontario,Scarborough,Bar Harbour Sq. Scarborough ON,Infant Toddler Preschool,(416)992-3274,
A Child's Place Daycare Centre,Ontario,Scarborough,10 Howarth Ave Scarborough ON,Toddler Kindergarten Preschool Schoolage,416 755 6381,
A Happy Place,Ontario,Scarborough,Murison Blvd Scarborough ON,Infant Toddler Kindergarten Preschool Schoolage,416 281-0769,
Archway Montessori School,Ontario,Scarborough,3385 Lawrence Avenue East Scarborough ON,Toddler Kindergarten Preschool,4164388103,
ASHLEY'S LEARNING DAYCARE,Ontario,Scarborough,40 Parkcrest Dr. Scarborough ON,Infant Toddler Kindergarten Preschool Schoolage,6476935304,
Baby Duck Daycare,Ontario,Scarborough,29 Craiglee Drive Scarborough ON,Infant Toddler Preschool,6472980341,
BEAUTIFUL BEGINNINGS HOME DAYCARE,Ontario,Scarborough,ROTARY DRIVE Scarborough ON,,4168233974,
Bev's Home Daycare,Ontario,Scarborough,Archibald Mews Scarborough ON,Infant Toddler Preschool,416-792-4050,
The Big Comfy Couch Home Daycare,Ontario,Schomberg,Main St Schomberg ON,Infant Toddler Preschool,6478222641,
BACK TO NATURE Childcare,Ontario,Sebright,Lowanda Lane Sebright ON,Infant Toddler Kindergarten Preschool Schoolage,905-716-2350,
Natural Choice Home Daycare,Ontario,Seguin,Humphrey Seguin ON,Kindergarten Schoolage,705 309-8432,
The Playhouse,Ontario,Sharbot Lake,Highway 7 Sharbot Lake ON,Infant Toddler Kindergarten Preschool Schoolage,,
Elizabeth's Home Child Care,Ontario,Shelburne,Berry Street Shelburne ON,Infant Toddler Preschool,647.999.6695,
Mrs.Deena's Montessori Luvbugs,Ontario,Shelburne,Berry Street Shelburne ON,Infant Toddler Preschool,519217-0959,
Ana's Child Care,Ontario,Shelburne,First Ave East Shelburne ON,Toddler Preschool,705-333-0000,
Count Your Little Blessings Childcare (Home Daycare),Ontario,Shelburne,Simon St Shelburne ON,Infant Toddler Kindergarten Preschool Schoolage,705-812-1425,
Elizabeth's Home Child Care,Ontario,Shelburne,Berry Street Shelburne ON,Infant Toddler Preschool,647.999.6695,
K,Ontario,Shelburne,215 Second Ave West. Shelburne ON,Infant Toddler Kindergarten Preschool Schoolage,647-382-6630,
Mrs.Deena's Montessori Luvbugs,Ontario,Shelburne,Berry Street Shelburne ON,Infant Toddler Preschool,519217-0959,
Our Happy Home,Ontario,Shelburne,Armstrong. Rd Shelburne ON,Infant Toddler Kindergarten Preschool Schoolage,519-938-0522,
April's Child Care,Ontario,Simcoe,128 robinson st Simcoe ON,Infant,519-429-0010,
Corrie's Day Care,Ontario,Simcoe,Thorncliff Rd. Simcoe ON,Infant Toddler Kindergarten Preschool Schoolage,519-909-8434,
Jane's Place Home Daycare,Ontario,Simcoe,8 Howard Street Simcoe ON,Infant Toddler Preschool,519-428-8009,
Leslie's Home Daycare,Ontario,Simcoe,108 Orchard Ave. Simcoe ON,Infant Toddler Kindergarten Preschool,519-426-3549,
Tia Beck's Day Care,Ontario,Simcoe,Redbud Cresc. Simcoe ON,Infant Toddler Preschool,2269204559,
Christine's Home Dayare,Ontario,Smiths Falls,Bond St Smiths Falls ON,Infant Toddler Kindergarten Preschool Schoolage,613-277-8523,
Em's Place,Ontario,Smiths Falls,Marsha Drive Smiths Falls ON,Toddler Kindergarten Preschool Schoolage,6132854625,
L'il Caterpillars Daycare,Ontario,Smiths Falls,69 William St West Smiths Falls ON,Infant Toddler Kindergarten Preschool Schoolage,6136981717,
Li'l Boots Daycare,Ontario,Smiths Falls,Condie Street Smiths Falls ON,Infant Toddler Preschool,613-812-3289,
Tiny Monkeys Child Care Learning Centre,Ontario,Smiths Falls,Chambers St. Smiths Falls ON,Infant Toddler Kindergarten Preschool Schoolage,6132906422,
Melo Daycare,Ontario,Smithville,3534 Thirty Road Smithville ON,Infant Toddler Kindergarten Preschool Schoolage,905-957-1742,
City Mouse Daycare,Ontario,South Mountain,County 3 Road South Mountain ON,Infant Toddler Kindergarten Preschool Schoolage,6137150312,
Leslie's Little Angels Home Daycare,Ontario,South Mountain,County Rd 3 South Mountain ON,Infant Toddler Kindergarten Preschool Schoolage,,
Puddle Jumpers,Ontario,Spencerville,9145 County Road 44 Spencerville ON,Infant Toddler Kindergarten Preschool Schoolage,613-258-6630,
Alexandra's Home Daycare,Ontario,St. Catharines,"Colbey Street, St. St. Catharines ON",Infant Toddler Kindergarten Preschool Schoolage,,
Angels From Heaven Daycare,Ontario,St. Catharines,10 Allan Drive St. Catharines ON,Infant Toddler Preschool,905-937-2829,
Ashleigh's Daycare,Ontario,St. Catharines,Barton Street St. Catharines ON,Infant Toddler Preschool,,
Bonnie's Daycare,Ontario,St. Catharines,307 1/2 St. Paul St West St. Catharines ON,Toddler Kindergarten Preschool Schoolage,905-688-1924,
Bright Beginnings,Ontario,St. Catharines,10 Appleford Rd. St. Catharines ON,Infant Toddler Preschool,905-984-5640,
Broadway Home Daycare,Ontario,St. Catharines,38 Cherie Rd. St. Catharines ON,Infant Toddler Preschool,905-938-5038,
CDH Child Care,Ontario,St. Catharines,Carriage Road St. Catharines ON,Infant Toddler Kindergarten Preschool Schoolage,905-684-6193,
Childrens Choice Childcare,Ontario,St. Catharines,1 Natalie Crt St. Catharines ON,Infant Toddler Kindergarten Preschool Schoolage,289 931 2436,
Cindy's Home Daycare (before And Afterschool Care Only),Ontario,St. Catharines,oxford street St. Catharines ON,Kindergarten Schoolage,289-271-2912,
Creative Kids Quality Care,Ontario,St. Catharines,Westchester Cresent St. Catharines ON,Infant Toddler Kindergarten Preschool,905 321 7126,
PROGRESSIONS CHILDCARE,Ontario,St. George,Windsor Drive St. George ON,Infant Toddler,519-658-5921,
Garderie Des Tout-petits,Ontario,St. Isidore De Prescott,st-isidore St. Isidore de Prescott ON,Preschool,613-314-5427,
Jean's Little Beans,Ontario,St. Jacobs,Young St. St. Jacobs ON,Infant Toddler Preschool,519-664-1270,
Tracys Tiny Tots Daycare,Ontario,St. Marys,17 Millson Cres. St. Marys ON,Infant Toddler Preschool,(519)284-8026,
Crystal's ChildCare,Ontario,St. Thomas,Cavanaugh Cres St. Thomas ON,Infant Toddler Kindergarten Preschool Schoolage,2263762147,
Dana's Daycare,Ontario,St. Thomas,Peach Tree Blvd St. Thomas ON,Infant Toddler Preschool,519-631-0780,
Little Cubs Daycare,Ontario,St. Thomas,19 Sifton Drive St. Thomas ON,Infant Toddler Preschool,5192827508,
Melissa's Fun Tymes Home Child Care,Ontario,St. Thomas,Hawthorn Court St. Thomas ON,Infant Toddler Preschool,5192072373,
Wee Ones On Wellington - Nicole's Home Daycare,Ontario,St. Thomas,12198 Wellington Road St. Thomas ON,Infant Toddler Kindergarten Preschool,519-280-1897,
Dayhome,Ontario,Stayner,Eric St Stayner ON,Infant Toddler Preschool,705-430-3945,
Heather's Daycare,Ontario,Stayner,John St. Stayner ON,Infant Toddler Preschool,(705)428-6188,
Jen's House Home Childcare,Ontario,Stayner,Louisa Street Stayner ON,Kindergarten Schoolage,,
Over The Moon Child Care,Ontario,Stayner,202 Aspen Ridge Drive Stayner ON,Infant Toddler Kindergarten Preschool Schoolage,705-441-2335,
Little Lambs Home Daycare,Ontario,Stirling,St James St Stirling ON,Infant Toddler Kindergarten Preschool Schoolage,,
Amanda Sage's Home Daycare,Ontario,Stittsville,402 Montserrat Street Stittsville ON,Infant Toddler Preschool,513 618 6359,
Amanda's Daycare,Ontario,Stittsville,Kathleen Cresent Stittsville ON,Toddler Kindergarten Preschool Schoolage,613-836-9710,
Chez Tatie,Ontario,Stittsville,Landswood Way Stittsville ON,Infant Toddler Kindergarten Preschool,613-899-4014,
Chris's Cozy Corner,Ontario,Stittsville,victor street Stittsville ON,Schoolage,613-862-8808,
Cozy Corner Daycare,Ontario,Stittsville,2 Basswood Ave Stittsville ON,Toddler Kindergarten Preschool Schoolage,613 963-0157,
D Daycare,Ontario,Stittsville,Alon Street Stittsville ON,Infant Toddler Kindergarten Preschool Schoolage,613-836-3107,
Daddy Homecare,Ontario,Stittsville,Santa Anna Lane Stittsville ON,Toddler Kindergarten Preschool Schoolage,613-726-7257,
Dana's Daycare,Ontario,Stittsville,Poole Creek Crescent Stittsville ON,Infant Toddler Kindergarten Preschool Schoolage,613-601-5102,
Danah's Young Scholars,Ontario,Stittsville,Wrangler Circle Stittsville ON,Infant Toddler Kindergarten Preschool Schoolage,613-435-5369,
Dina's Home Daycare,Ontario,Stittsville,denali way Stittsville ON,Infant Toddler Preschool,,
Angela's Home Childcare,Ontario,Stoney Creek,Bel-Air Ave Stoney Creek ON,Toddler Preschool,905-643-6211,
Austin Academy For Early Learners,Ontario,Stoney Creek,288 Barton Street Stoney Creek ON,Preschool,905-662-0377,
BABE'S AND TOT'S DAYCARE,Ontario,Stoney Creek,west glen avenue Stoney Creek ON,Infant Toddler Kindergarten Preschool Schoolage,9056648347,
